### ISSUE TITLE
Scapy does not get answers in sr()

### ISSUE THREAD

**Issue by JasonLZJ** [secdev/scapy#681]
I use scapy to construct tcp packet from host A to host B:
sr(IP(dst=host_B')/TCP(dport=61000,sport=60001,flags='F'),timeout=3,iface='bond0')

Some times I found scapy returns me like that:

Begin emission:
...........Finished to send 1 packets.
..............................................................................................................................................................................................................................................................................................................................................................................................................................................................
Received 4579 packets, got 0 answers, remaining 1 packets

Some times it will be fine, like:

Begin emission:
.....................Finished to send 1 packets.
..............................................................................*
Received 100 packets, got 1 answers, remaining 0 packets

I use tcpdump  from host A:

15:48:41.367184 IP Host_A.60001 > Host_B.61000: Flags [F], seq 0, win 8192, length 0
15:48:41.367298 IP Host_B.61000 > Host_A.60001: Flags [R.], seq 0, ack 1, win 0, length 0

I use tcpdump fro host B:

15:50:48.162727 IP Host_A.60001 >Host_B.61000: Flags [F], seq 0, win 8192, length 0
15:50:48.162738 IP Host_B.61000 > Host_A.60001: Flags [R.], seq 0, ack 1, win 0, length 0

A and B both received the packet, but scapy dit not. sr1[] function have the same problem for me.

What's the problem? Thank you.

**Comment by p-l-** [comment]
Hi,

Can you report the OS you are using, and the exact Scapy version?

Also, do you have the same problem when using "regular" (i.e., non-bond) interfaces?

**Comment by JasonLZJ** [comment]
hi @p-l- 
I use CentOS 6 and python==2.6.6 scapy== 2.3.3
I test it in my server (non-bond) interfaces it runs fine.

**Comment by p-l-** [comment]
This could be either related to bond interfaces, or to heavy network traffic causing Scapy to miss packets. Can you check on a server where you have the issue if it still happens when traffic is low?

**Comment by JasonLZJ** [comment]
hi @p-l- 
You mean the server network is busy or our network switch？
I use tcpdump can get the packet, but scapy not. It does not seem to be a server problem？
Can I avoid packet loss by using set parameters for scapy?
thank you

**Comment by guedou** [comment]
@JasonLZJ a simple way to avoid packets loss is to use the `filter` argument. Scapy will only process the packets that match the filter.
