### ISSUE TITLE
Tests failing in Debian autopkgtest environment

### ISSUE THREAD

**Issue by charles2910** [secdev/scapy#3847]
### Brief description

Hi, I'm forwarding the discussion from [Debian's BTS #1027183](https://bugs.debian.org/cgi-bin/bugreport.cgi?bug=1027183). I'm working in the new release and I'm having trouble with the tests.

The first problem is that we upload only the tarball downloaded from github (so it's not a git repo) and run the tests on it. But since it's not a tarball the tests `Check Scapy version` and `_version()` from `test/regression.uts` fail (`git describe` fails).

The second problem is with `IPv4 - traceroute utilities` from `test/scapy/layers/inet.uts`. It's failing and I'm not exactly sure why. The output is:

```bash
###(051)=[failed] IPv4 - traceroute utilities

>>> ip_ttl = [("192.168.0.%d" % i, i) for i in six.moves.range(1, 10)]
>>> 
>>> tr_packets = [ (IP(dst="192.168.0.1", src="192.168.0.254", ttl=ttl)/TCP(options=[("Timestamp", "00:00:%.2d.00" % ttl)])/"scapy",
...                 IP(dst="192.168.0.254", src=ip)/ICMP(type=11)/IPerror(dst="192.168.0.1", src="192.168.0.254", ttl=0)/TCPerror()/"scapy")
...                for (ip, ttl) in ip_ttl ]
>>> 
>>> tr = TracerouteResult(tr_packets)
>>> assert tr.get_trace() == {'192.168.0.1': {1: ('192.168.0.1', False), 2: ('192.168.0.2', False), 3: ('192.168.0.3', False), 4: ('192.168.0.4', False), 5: ('192.168.0.5', False), 6: ('192.168.0.6', False), 7: ('192.168.0.7', False), 8: ('192.168.0.8', False), 9: ('192.168.0.9', False)}}
>>> 
>>> def test_show():
...     with ContextManagerCaptureOutput() as cmco:
...         tr = TracerouteResult(tr_packets)
...         tr.show()
...         result_show = cmco.get_output()
...     expected = "  192.168.0.1:tcp80  \n"
...     expected += "1 192.168.0.1     11 \n"
...     expected += "2 192.168.0.2     11 \n"
...     expected += "3 192.168.0.3     11 \n"
...     expected += "4 192.168.0.4     11 \n"
...     expected += "5 192.168.0.5     11 \n"
...     expected += "6 192.168.0.6     11 \n"
...     expected += "7 192.168.0.7     11 \n"
...     expected += "8 192.168.0.8     11 \n"
...     expected += "9 192.168.0.9     11 \n"
...     index_result = result_show.index("\n1")
...     index_expected = expected.index("\n1")
...     assert result_show[index_result:] == expected[index_expected:]
... 
>>> test_show()
>>> 
>>> def test_summary():
...     with ContextManagerCaptureOutput() as cmco:
...         tr = TracerouteResult(tr_packets)
...         tr.summary()
...         result_summary = cmco.get_output()
...     assert len(result_summary.split('\n')) == 10
...     assert(any(
...         "IP / TCP 192.168.0.254:%s > 192.168.0.1:%s S / Raw ==> "
...         "IP / ICMP 192.168.0.9 > 192.168.0.254 time-exceeded "
...         "ttl-zero-during-transit / IPerror / TCPerror / "
...         "Raw" % (ftp_data, http) in result_summary
...         for ftp_data in ['21', 'ftp_data']
...         for http in ['80', 'http', 'www_http', 'www']
...     ))
... 
>>> test_summary()
Traceback (most recent call last):
  File "<input>", line 2, in <module>
  File "<input>", line 8, in test_summary
AssertionError



UTscapy ended with error code 1
```

 @gpotter2 asked for the output of the following snippet.

```python
ip_ttl = [("192.168.0.%d" % i, i) for i in six.moves.range(1, 10)]

tr_packets = [ (IP(dst="192.168.0.1", src="192.168.0.254", ttl=ttl)/TCP(options=[("Timestamp", "00:00:%.2d.00" % ttl)])/"scapy",
                IP(dst="192.168.0.254", src=ip)/ICMP(type=11)/IPerror(dst="192.168.0.1", src="192.168.0.254", ttl=0)/TCPerror()/"scapy")
               for (ip, ttl) in ip_ttl ]

tr = TracerouteResult(tr_packets)
tr.summary()
```

And it is:

```bash
>>> IP / TCP 192.168.0.254:20 > 192.168.0.1:80 S / Raw ==> IP / ICMP 192.168.0.1 > 192.168.0.254 time-exceeded ttl-zero-during-transit / IPerror / TCPerror / Raw
IP / TCP 192.168.0.254:20 > 192.168.0.1:80 S / Raw ==> IP / ICMP 192.168.0.2 > 192.168.0.254 time-exceeded ttl-zero-during-transit / IPerror / TCPerror / Raw
IP / TCP 192.168.0.254:20 > 192.168.0.1:80 S / Raw ==> IP / ICMP 192.168.0.3 > 192.168.0.254 time-exceeded ttl-zero-during-transit / IPerror / TCPerror / Raw
IP / TCP 192.168.0.254:20 > 192.168.0.1:80 S / Raw ==> IP / ICMP 192.168.0.4 > 192.168.0.254 time-exceeded ttl-zero-during-transit / IPerror / TCPerror / Raw
IP / TCP 192.168.0.254:20 > 192.168.0.1:80 S / Raw ==> IP / ICMP 192.168.0.5 > 192.168.0.254 time-exceeded ttl-zero-during-transit / IPerror / TCPerror / Raw
IP / TCP 192.168.0.254:20 > 192.168.0.1:80 S / Raw ==> IP / ICMP 192.168.0.6 > 192.168.0.254 time-exceeded ttl-zero-during-transit / IPerror / TCPerror / Raw
IP / TCP 192.168.0.254:20 > 192.168.0.1:80 S / Raw ==> IP / ICMP 192.168.0.7 > 192.168.0.254 time-exceeded ttl-zero-during-transit / IPerror / TCPerror / Raw
IP / TCP 192.168.0.254:20 > 192.168.0.1:80 S / Raw ==> IP / ICMP 192.168.0.8 > 192.168.0.254 time-exceeded ttl-zero-during-transit / IPerror / TCPerror / Raw
IP / TCP 192.168.0.254:20 > 192.168.0.1:80 S / Raw ==> IP / ICMP 192.168.0.9 > 192.168.0.254 time-exceeded ttl-zero-during-transit / IPerror / TCPerror / Raw
```

The tests are run in a chroot environment with limited resources. The main idea of testing the Debian package is to ensure it's working, but it doesn't need to be an extensive test, so I'd like to know if there is an even smaller subset of tests that I can use instead.

### Scapy version

2.4.5

### Python version

3.10

### Operating system

Debian unstable

### How to reproduce

I'm running the tests in Debian's testing framework, `autopkgtest`. I'm using the set of tests suggested by Gabriel: `./test/run_tests -c test/configs/linux.utsc -K tcpdump -K manufdb -K wireshark -K ci_only -K vcan_socket -K automotive_comm -K imports -K scanner -K netaccess -K root -K tshark -K brotli -K zstd`. 

You can check the [test log](https://salsa.debian.org/charles/scapy/-/jobs/3778201) in my [fork of the Debian's packaging repo](https://salsa.debian.org/charles/scapy/)

### Expected result

All tests suceeding.

**Comment by evverx** [comment]
Looks like the `netbase` package (which provides `/etc/services` among other things) isn't installed. I think it should probably be an explicit scapy dependency.

**Comment by evverx** [comment]
Having said that there appears to be a bug in the test. With the following patch applied the test passes without the `netbase` package:
```diff
diff --git a/test/scapy/layers/inet.uts b/test/scapy/layers/inet.uts
index dd7efa68..a8987ec3 100644
--- a/test/scapy/layers/inet.uts
+++ b/test/scapy/layers/inet.uts
@@ -573,7 +573,7 @@ def test_summary():
         "IP / ICMP 192.168.0.9 > 192.168.0.254 time-exceeded "
         "ttl-zero-during-transit / IPerror / TCPerror / "
         "Raw" % (ftp_data, http) in result_summary
-        for ftp_data in ['21', 'ftp_data']
+        for ftp_data in ['20', 'ftp_data']
         for http in ['80', 'http', 'www_http', 'www']
     ))
```

**Comment by gpotter2** [comment]
You're right this is a bug in our test, thanks for the patch !
It's more of a runtime check than an actual dependency since we handle it not being available.

I'm more surprised by the issue with `git` not being available. Supposedly those tests mock everything and don't actually require git from being installed, but it could be a bug as well. I'll look into this

**Comment by evverx** [comment]
> Supposedly those tests mock everything and don't actually require git from being installed

As far as I can remember autopkg tests just install the dependencies listed among Build-Depends. The scapy debian package doesn't seem to depend on `git` to judge from https://salsa.debian.org/charles/scapy/-/blob/debian/master/debian/control#L6 so `git` isn't installed to the chroot environment. Interestingly `git` indirectly brings the `netbase` package and that's probably why those tests have never failed on the CI (where `git` is used to clone `scapy` to run the tests).

There are other tests that fail without the `netbase` package but I haven't taken a closer look yet.

FWIW as far as I can seen there is a test allocating 4GB in one fell swoop and that triggers the OverflowError exception on 32-bit machines and the MemoryError exception on VMs with limited resources. It come from
```
test/contrib/isotp_packet.uts:    fragments = ISOTP(b"a" * (1 << 32)).fragment()
```

**Comment by evverx** [comment]
I "fixed" two more tests with
```
sed -i "s/dport='netbios_ns'/dport=137/" test/scapy/layers/netbios.uts
sed -i "s/proto='udp'/proto=17/g" test/contrib/ikev2.uts
```
I'm not sure how to fix them properly though. At least the netbios test seems to pass `'netbios_ns'` intentionally to exercise the code paths converting names into numbers.

Also the `TracerouteResult6` expects `:udpdomain` somewhere so it should probably test either that or `:udp53` when `/etc/services` isn't available.

**Comment by evverx** [comment]
I think something like
```python
IP_PROTOS and 'udp' or 17
```
and
```python
UDP_SERVICES and 'netbios_ns' or 137
```
should probably cover the netbios and ikev2 tests. At least it's the only way I came up with to keep exercising the code paths converting names to numbers without failing when `/etc/protocols` and `/etc/services` aren't available.

**Comment by charles2910** [comment]
Thanks for taking a look. I need to make a couple comments.

About the failing `IPv4 - traceroute utilities`: I'm executing the tests locally with `autopkgtest` and it's failing just like showed in my first report, but it's not failing in the pipeline set up in the Debian's gitlab instance. So maybe the test is okay, I'm a bit confused :-(

About the git problem: `git` wasn't declared as a dependency, though I did test earlier today with it set as a dependency and those 2 tests are still failing (locally with `autopkgtest` and `schroot`). I'll attach the log below.

```bash
Regression tests for Scapy
━ Run at 13:48:19 from [test/regression.uts] by UTscapy in 1.1054551601409912
 └ Passed=246
 └ Failed=2

######
## Information on Scapy
######


###(003)=[failed] Check Scapy version

>>> import mock
>>> 
>>> import scapy
>>> from scapy import _parse_tag, _version_from_git_describe
>>> from scapy.config import _version_checker
>>> 
>>> b = Bunch(returncode=0, communicate=lambda *args, **kargs: (b"v2.4.5rc1-261-g44b98e14", None))
>>> with mock.patch('scapy.subprocess.Popen', return_value=b) as popen:
...     class GitModuleScapy(object):
...         __version__ = _version_from_git_describe()
... 
Traceback (most recent call last):
  File "<input>", line 3, in <module>
  File "<input>", line 4, in GitModuleScapy
  File "/tmp/autopkgtest.O3ldG0/autopkgtest_tmp/src/scapy/__init__.py", line 64, in _version_from_git_describe
    raise ValueError('not in scapy git repo')
ValueError: not in scapy git repo


######
## Scapy version
######


###(300)=[failed] _version()

>>> import os
>>> version_filename = os.path.join(scapy._SCAPY_PKG_DIR, "VERSION")
>>> 
>>> version = "2.0.0"
>>> with open(version_filename, "w") as fd:
...     fd.write(version)
... 
5
>>> import mock
>>> with mock.patch("scapy._version_from_git_describe") as version_mocked:
...     version_mocked.side_effect = Exception()
...     assert scapy._version() == version
...     os.unlink(version_filename)
...     assert scapy._version() == "unknown.version"
... 
Traceback (most recent call last):
  File "<input>", line 4, in <module>
AssertionError



UTscapy ended with error code 1
```

**Comment by evverx** [comment]
> it's not failing in the pipeline set up in the Debian's gitlab instance

I took a look at the pipeline and the image it downloads comes with `/etc/protocols` and `/etc/services`
```
# wget https://salsa.debian.org/salsa-ci-team/autopkgtest-lxc/-/jobs/3772133/artifacts/raw/artifacts/lxc.tar
# tar -xvf lxc.tar
...
# ls -l autopkgtest-unstable-amd64/rootfs/etc/{services,protocols}
-rw-r--r--. 1 root root  3144 Oct 17 22:19 autopkgtest-unstable-amd64/rootfs/etc/protocols
-rw-r--r--. 1 root root 12813 Mar 27  2021 autopkgtest-unstable-amd64/rootfs/etc/services
```
so it probably explains why it passes there and fails with the base images (where almost no packages apart from the ones listed in Build-Deps are installed).

> though I did test earlier today with it set as a dependency and those 2 tests are still failing

They fail even with git installed. It can be reproduced by downloading the latest tarball, unpacking it and running the unit tests.

**Comment by evverx** [comment]
> git wasn't declared as a dependency, though I did test earlier today with it set as a dependency

FWIW @charles2910 I'm not sure whether `git` should be a dependency or not in the end but I think it would be great if it would be possible to add the `netbase` package to the dependencies. Without it `scapy` kind of works but if it's installed on top of the base images it throws assertions like
```
ValueError: Incorrect type of value for field dport:
struct.error('required argument is not an integer')
To inject bytes into the field regardless of the type, use RawVal. See help(RawVal)
```
when something like `raw(UDP(dport='domain'))` is run.

Regarding the `git describe` tests I think they should probably be just skipped since they can't pass when they are run from inside regular directories.

**Comment by evverx** [comment]
Looks like the `_version` test could in theory pass from inside unpacked tarballs (because `_version_from_git_describe` is mocked there) but there https://github.com/secdev/scapy/blob/0ea948f2e7651ddfff6019a9d2833f964f8b7cfc/scapy/__init__.py#L98
is replaced with something like
```python
git_archive_id = '9473f77d8b v2.5.0'.strip().split()
```
and `_version()` returns `2.5.0` instead of taking the branch where the `VERSION` file with `2.0.0` is read.

**Comment by charles2910** [comment]
> FWIW @charles2910 I'm not sure whether `git` should be a dependency or not in the end but I think it would be great if it would be possible to add the `netbase` package to the dependencies. Without it `scapy` kind of works but if it's installed on top of the base images it throws assertions like
> 
> ```
> ValueError: Incorrect type of value for field dport:
> struct.error('required argument is not an integer')
> To inject bytes into the field regardless of the type, use RawVal. See help(RawVal)
> ```
> 
> when something like `raw(UDP(dport='domain'))` is run.

Agree, I'm adding `netbase` as a test dependency. Tests are succeeding now :-)

> Regarding the `git describe` tests I think they should probably be just skipped since they can't pass when they are run from inside regular directories.

Is there a more elegant away to disable specif tests? Right now I'm just deleting those 2 via patch and everything is fine

**Comment by evverx** [comment]
> Is there a more elegant away to disable specif tests?

I think as a stopgap another option would be to (temporarily) add a keyword like `passes_in_git_repo` to those tests and disable them by additionally passing `-K passes_in_git_repo` to `run_tests`:
```diff
--- a/test/regression.uts
+++ b/test/regression.uts
@@ -45,6 +45,7 @@ assert not _version_checker(FakeModule2, (5, 143, 4))
 assert _version_checker(FakeModule3, (2, 4, 2))

 = Check Scapy version
+~ passes_in_git_repo

 import mock

@@ -4758,6 +4759,7 @@ assert pl[1][Ether].dst == '00:22:33:44:55:66'
 ############
 ############
 + Scapy version
+~ passes_in_git_repo

 = _version()
```
but that would still be a stopgap. I think ideally those tests should be skipped automatically. For example the `Check Scapy version` could catch the ValueError exception on importing `_version_git_describe` and skip itself automatically. The other test can be made to work from inside unpacked tarballs as well but I haven't figured out how to do that yet.

**Comment by evverx** [comment]
>  I'm adding netbase as a test dependency. 

@charles2910 I think it would be great if it could be added to "Recommends" as well. This way it would be installed along with `scapy` even on top of the base images (as long as `--no-install-recommends` isn't passed anywhere) and scripts (where names are usually used instead of numbers) should start working right away without having to additionally install the `netbase` package. I suspect in most cases `netbase` is somehow installed by accident along with other packages but it would be better if the dependency was explicit. I have a bunch of scapy scripts responsible among other things for sending packets generated by a custom fuzzer and sent to various parts of `systemd` to catch stuff like https://github.com/systemd/systemd/issues/23894, https://github.com/systemd/systemd/issues/23873 and https://github.com/systemd/systemd/issues/25449. I've just checked and they all fell apart on Debian once I ran `apt-get install scapy`. I can of course install `netbase` manually to get the scripts to work but that's not very convenient probably.

**Comment by charles2910** [comment]
I did look into it, turns out `netbase` has a `Priority: important`  so it's installed even in minimal installations of Debian by default. Are you experiencing a case where it's not installed?

**Comment by evverx** [comment]
> Are you experiencing a case where it's not installed?

Yes, I am. It can be reproduced with podman (or docker)
```sh
$ podman run -it debian:unstable
# dpkg -l | grep netbase # the output is empty
# ls /etc/services
ls: cannot access '/etc/services': No such file or directory
```
Those images are somewhat slim.

**Comment by evverx** [comment]
@charles2910 I found https://github.com/debuerreotype/docker-debian-artifacts/issues/36#issuecomment-385212707 where `netbase` disappeared. It's been this way since 2018 as far as I can tell.

**Comment by evverx** [comment]
@charles2910 having taken a closer look at those images they are created using `debootstrap --variant=minbase` (which only includes essential packages and apt) and since `netbase` isn't essential and no essential packages depend on it it appears all images built using the minbase variant come without `netbase`. I'm not sure how often images like that are used to run `scapy` but in general in seems it doesn't safe to assume that `netbase` is always present.

**Comment by charles2910** [comment]
Ok, thanks @evverx for looking into this. I think we can add as Recommends, but I'm talking to a more experienced person to decide if we're going to put it in Depends, Recommends or Suggests.

**Comment by gpotter2** [comment]
The latest commit of https://github.com/secdev/scapy/pull/3848 should fix all `git` related issues in the tests. Thanks for reporting
Do you need any changes on our side regarding `netbase` missing?

**Comment by charles2910** [comment]
No problem, also thanks to you guys for being so welcoming. I don't think you have to change anything on your side, maybe document this dependency for people not using a distro package.

There is one other thing I noticed when running Debian's CI tests. There is an ongoing effort regarding reproducible builds in Debian so we have tests checking for it. scapy - actually `python-scapy-doc` package which contains scapy's documentation - is currently [not building reproducibly](https://salsa.debian.org/charles/scapy/-/jobs/3785752). There are some places where the date/time of the build is embedded and others that I'm not sure where the differences are coming from. If this is something that you'd like to tackle, let me know so I can open a bug and list the problematic places.

**Comment by charles2910** [comment]
Hi, guys (sorry to bother again).

During the tests with autopkgtest in Salsa's CI an exception is thrown. But I'm not seeing it in your tests nor in my local tests. The thing is it's not causing any tests failures. The test log:

```bash
...
passed EE5096F6 000.00s PacketField
Exception in thread scapy.automaton _do_start:
Traceback (most recent call last):
  File "/usr/lib/python3.11/threading.py", line 1038, in _bootstrap_inner
    self.run()
  File "/usr/lib/python3.11/threading.py", line 975, in run
    self._target(*self._args, **self._kwargs)
  File "/tmp/autopkgtest-lxc.hwk2hjvc/downtmp/autopkgtest_tmp/src/scapy/automaton.py", line 1159, in _do_control
    self.listen_sock.close()
    ^^^^^^^^^^^^^^^^^^^^^^
AttributeError: 'MockRRQSocket' object has no attribute 'close'
passed FA8512FC 000.00s Parsing a human-readable UUID
...
```

One thing to note, it's running on python 3.11 (though my local test is too).

**Comment by evverx** [comment]
I haven't taken a closer look yet but it can be reproduced (more or less reliably) by running something like
```sh
./test/run_tests -t test/tftp.uts -n 0-3 -F
━ UTScapy - Scapy 2.5.0.dev12 - 3.10.9
 └ Non-root mode
 └ Booting scapy...
 └ Discovering tests files...
━ Loading: test/tftp.uts
passed CBBFDA20 000.00s Test answers
passed D559286B 000.00s Utilities
passed F88AFFD0 000.01s TFTP_read() automaton
passed A974A974 000.01s TFTP_read() automaton error
Exception in thread scapy.automaton _do_start:
Traceback (most recent call last):
  File "/usr/lib64/python3.10/threading.py", line 1016, in _bootstrap_inner
Campaign CRC=913D7EA5 in 000.02s SHA=3A46E0AF5C478AAD6EA6C1B0822E5EEC7DC92353
PASSED=4 FAILED=0
✓ All campaigns executed. Writing output...

Regression tests for TFTP
━ Run at 13:38:31 from [test/tftp.uts] by UTscapy in 0.021495580673217773
 └ Passed=4
 └ Failed=0


UTscapy ended successfully

WARNING: UNFINISHED THREADS
[<_MainThread(MainThread, started 139756419569472)>, <Thread(scapy.automaton _do_start, started daemon 139756339910208)>]
    self.run()
  File "/usr/lib64/python3.10/threading.py", line 953, in run
    self._target(*self._args, **self._kwargs)
  File "/home/vagrant/scapy/scapy/automaton.py", line 1160, in _do_control
    self.listen_sock.close()
AttributeError: 'MockReadSocket' object has no attribute 'close'
```

I'm 99% sure that exception is harmless but as long as it's there @charles2910 I wonder if it would be possible to temporarily set `Restrictions: allow-stderr` to prevent the autopkg tests from failing because of that.

I'll try to take a closer look a bit later. Sorry! I'm porting my fuzzers to `scapy 2.3.5` at the moment and some stuff like https://github.com/systemd/systemd/issues/26151 and https://github.com/systemd/systemd/issues/25891 keeps popping up here and there.

**Comment by charles2910** [comment]
> I'm 99% sure that exception is harmless but as long as it's there @charles2910 I wonder if it would be possible to temporarily set `Restrictions: allow-stderr` to prevent the autopkg tests from failing because of that.

Yeah, since no tests are failing, I did that.

> I'll try to take a closer look a bit later. Sorry! I'm porting my fuzzers to `scapy 2.5.0` at the moment and some stuff like [systemd/systemd#26151](https://github.com/systemd/systemd/issues/26151) and [systemd/systemd#25891](https://github.com/systemd/systemd/issues/25891) keeps popping up here and there.

No problem, I'm just reporting so we can improve scapy (I also wasn't sure if it was a big problem or not).

**Comment by gpotter2** [comment]
Thanks for reporting, https://github.com/secdev/scapy/pull/3867/files should be an easy way of fix that

**Comment by charles2910** [comment]
Hi again. Last thing I promise :-)

> There is one other thing I noticed when running Debian's CI tests. There is an ongoing effort regarding reproducible builds in Debian so we have tests checking for it. scapy - actually `python-scapy-doc` package which contains scapy's documentation - is currently [not building reproducibly](https://salsa.debian.org/charles/scapy/-/jobs/3785752). There are some places where the date/time of the build is embedded and others that I'm not sure where the differences are coming from. If this is something that you'd like to tackle, let me know so I can open a bug and list the problematic places.

@evverx and @gpotter2 should I open a bug in scapy?

And there is [one license problem I found](https://github.com/secdev/scapy/issues/3321#issuecomment-1398738672). TLDR (mostly) everything under `doc/scapy` is licensed as CC-By-NC-SA-2.5 (but without SPDX license identifier) which isn't DFSG compliant (because of noncommercial clause) and can't be in Debian. Should I reopen #3321 and/or #3031?

**Comment by evverx** [comment]
>  https://github.com/secdev/scapy/pull/3867/files should be an easy way of fixing that

Thanks! Looks like `Restrictions: allow-stderr` can safely be removed from the package once that patch lands.

> And there is https://github.com/secdev/scapy/issues/3321#issuecomment-1398738672.

That's unfortunate but looking at https://github.com/secdev/scapy/commit/652baabe1fffc3dff6c3f11d37763e529ee3cb8f it seems those particular tutorials were licensed like that explicitly so unless the author agrees to relicense them https://salsa.debian.org/charles/scapy/-/commit/5c14edd1625f78546ea373588fcce401d61e13e5 seems to be the safest option unfortunately. Anyway I think it would make sense to file a separate issue. I suspect other distributions packaging the documentation should run into that sooner or later by running their linters.

> > scapy - actually python-scapy-doc package which contains scapy's documentation - is currently [not building reproducibly](https://salsa.debian.org/charles/scapy/-/jobs/3785752).

I think it should probably go into a separate issue as well (probably along with the `diffoscope` command line used by the Debian package to make it easier to reproduce it locally) but personally I think it's a minor issue. While it certainly makes a lot of sense for the `scapy` package itself to be reproducible the documentation is much less important in this regard.

**Comment by gpotter2** [comment]
Just FTR, ca  you point out where it is mentioned that

> (mostly) everything under doc/scapy is licensed as CC-By-NC-SA-2.5

We're currently discussing this issue among maintainers, and looking into our possible options.

I must say I'm not sure I understand how documentation can be used commercially, or why this clause is an issue. We allow commercial use of Scapy and everyone can use the doc, but who would commercialise the doc?

**Comment by evverx** [comment]
> I'm not sure I understand how documentation can be used commercially

I think in general licenses like that are supposed to prevent companies selling, say, courses or books from free-riding (and there is nothing wrong with that if that's what authors want).

> why this clause is an issue

Debian is strict when it comes to licenses: https://en.wikipedia.org/wiki/Debian_Free_Software_Guidelines. In this particular case that clause isn't in line with "No discrimination against fields of endeavor, like commercial use".

**Comment by charles2910** [comment]
I've opened an issue (#3870) and pointed out the files - I was going to reopen #3031 but I can't do it.

The problem for Debian is exactly what @evverx pointed out. The DFSG mandates a series of points that a software must comply to be able to be in the distro and "No discrimination against fields of endeavor, like commercial use" is one of them.

There is a gray area in the problem because most files don't have a license boilerplate or copyright statement. So one could say they're licensed under scapy's license (GPL-2), but the `doc/scapy/index.rst` seems to imply everything in there is CC-By-NC-SA-2.5. I think the answer should be given by an expert or lawyer - which I'm not so this is just an opinion.

**Comment by evverx** [comment]
The fragment test was removed in https://github.com/secdev/scapy/pull/3848 (e83735b8) so `armel`, `armhf` and `i386` should pass with that patch applied.

I haven't tried to run the tests on s390x yet but I assume the failure is caused by its endianness

**Comment by evverx** [comment]
Looks like `StrFieldUtf16` uses `encode('utf-16')` under the hood and its results depend on the endianness

Here's what happens to the `cafe` string in little-endian containers
```sh
>>> 'cafe'.encode('utf-16')
b'\xff\xfec\x00a\x00f\x00e\x00'
>>> 'cafe'.encode('utf-16-le')
b'c\x00a\x00f\x00e\x00'
>>> 'cafe'.encode('utf-16-be')
b'\x00c\x00a\x00f\x00e'
```
in big-endian containers the byte order mark is different and the bytes are reversed:
```sh
>>> 'cafe'.encode('utf-16')
b'\xfe\xff\x00c\x00a\x00f\x00e'
>>> 'cafe'.encode('utf-16-le')
b'c\x00a\x00f\x00e\x00'
>>> 'cafe'.encode('utf-16-be')
b'\x00c\x00a\x00f\x00e'
```

**Comment by evverx** [comment]
Looking at all the places where that field is used it seems those protocols expect UTF16-LE so it can be "fixed" with
```diff
diff --git a/scapy/fields.py b/scapy/fields.py
index 87a5a2c0..f820e183 100644
--- a/scapy/fields.py
+++ b/scapy/fields.py
@@ -1427,7 +1427,7 @@ class StrField(_StrField[bytes]):
 class StrFieldUtf16(StrField):
     def h2i(self, pkt, x):
         # type: (Optional[Packet], Optional[str]) -> bytes
-        return plain_str(x).encode('utf-16')[2:]
+        return plain_str(x).encode('utf-16-le')

     def any2i(self, pkt, x):
         # type: (Optional[Packet], Optional[str]) -> bytes
@@ -1441,7 +1441,7 @@ class StrFieldUtf16(StrField):

     def i2h(self, pkt, x):
         # type: (Optional[Packet], bytes) -> str
-        return bytes_encode(x).decode('utf-16', errors="replace")
+        return bytes_encode(x).decode('utf-16-le', errors="replace")


 class _StrEnumField:
```
but I'm not 100% sure.

**Comment by charles2910** [comment]
> The fragment test was removed in #3848 ([e83735b](https://github.com/secdev/scapy/commit/e83735b8a7eb5a780dfc431fd035f9a4c330122f)) so `armel`, `armhf` and `i386` should pass with that patch applied.

I saw it last week and completely forgot about it, sorry. I've cherry-picked it to fix the test!

> I haven't tried to run the tests on s390x yet but I assume the failure is caused by its endianness

I think so too.

> Looking at all the places where that field is used it seems those protocols expect UTF16-LE so it can be "fixed" with
> 
> ```diff
> diff --git a/scapy/fields.py b/scapy/fields.py
> index 87a5a2c0..f820e183 100644
> --- a/scapy/fields.py
> +++ b/scapy/fields.py
> @@ -1427,7 +1427,7 @@ class StrField(_StrField[bytes]):
>  class StrFieldUtf16(StrField):
>      def h2i(self, pkt, x):
>          # type: (Optional[Packet], Optional[str]) -> bytes
> -        return plain_str(x).encode('utf-16')[2:]
> +        return plain_str(x).encode('utf-16-le')
> 
>      def any2i(self, pkt, x):
>          # type: (Optional[Packet], Optional[str]) -> bytes
> @@ -1441,7 +1441,7 @@ class StrFieldUtf16(StrField):
> 
>      def i2h(self, pkt, x):
>          # type: (Optional[Packet], bytes) -> str
> -        return bytes_encode(x).decode('utf-16', errors="replace")
> +        return bytes_encode(x).decode('utf-16-le', errors="replace")
> 
> 
>  class _StrEnumField:
> ```
> 
> but I'm not 100% sure.

Did you try it with a container? I can ask to a DD to test this fix in a s390x porterbox to confirm it's working and the tests are passing.

**Comment by evverx** [comment]
> Did you try it with a container?

I ran the tests with that patch applied on s390x and those two tests passed there. Some other tests failed due to
```
 SIOCETHTOOL(ETHTOOL_GET_TS_INFO) ioctl failed: Function not implemented
```
but it shouldn't affect Debian because the Debian CI probably uses bare-metal machines (or full-fledged VMs) instead of weird emulators.

> I can ask to a DD to test this fix in a s390x porterbox to confirm it's working and the tests are passing.

I think it would be great to run the tests with those two tests fixed to see what else fails on actual s390x machines.

**Comment by evverx** [comment]
I can actually hook up my fork of scapy to packit by analogy with https://github.com/lathiat/avahi/pull/422 to run the tests on those architectures using the Fedora infrastructure but it might take some time because I'd need to figure out how to edit the spec file to run the tests.

**Comment by gpotter2** [comment]
> Looking at all the places where that field is used it seems those protocols expect UTF16-LE so it can be "fixed" with
> [...]

Thanks for the report & the suggestion ! Sounds very reasonable & tests look good: https://github.com/secdev/scapy/pull/3874.

**Comment by evverx** [comment]
@gpotter2 thanks!

I managed to run the tests on more or less actual s390x machines and it seems that some other tests are failing there. On the bright side they appear to expose actual bugs. For example according to https://www.rfc-editor.org/rfc/rfc7252#section-3.1
> ... A 16-bit unsigned integer in network byte order follows the
         initial byte and indicates the Option Delta minus 269.

and the fix
```diff
diff --git a/scapy/contrib/coap.py b/scapy/contrib/coap.py
index a6f710f1..a3a3ac04 100644
--- a/scapy/contrib/coap.py
+++ b/scapy/contrib/coap.py
@@ -127,7 +127,7 @@ class _CoAPOpt(Packet):
     @staticmethod
     def _populate_extended(val):
         if val >= 269:
-            return struct.pack('H', val - 269), 14
+            return struct.pack('!H', val - 269), 14
         if val >= 13:
             return struct.pack('B', val - 13), 13
         return None, val
diff --git a/test/contrib/coap.uts b/test/contrib/coap.uts
index 2026bd97..49ad3654 100644
--- a/test/contrib/coap.uts
+++ b/test/contrib/coap.uts
@@ -27,7 +27,7 @@ assert p.options == [('Uri-Path', b'.well-known'), ('Uri-Path', b'core')]
 assert raw(CoAP(options=[("Uri-Query", "query")])) == b'\x40\x00\x00\x00\xd5\x02\x71\x75\x65\x72\x79'

 = Extended option length
-assert raw(CoAP(options=[("Location-Path", 'x' * 280)])) == b'\x40\x00\x00\x00\x8e\x0b\x00' + b'\x78' * 280
+assert raw(CoAP(options=[("Location-Path", 'x' * 280)])) == b'\x40\x00\x00\x00\x8e\x00\x0b' + b'\x78' * 280

 = Options should be ordered by option number
 assert raw(CoAP(options=[("Uri-Query", "b"),("Uri-Path","a")])) == b'\x40\x00\x00\x00\xb1\x61\x41\x62'
```
I'll try to take a closer look a bit later.

**Comment by evverx** [comment]
I'm not sure what to do about internal functions. Their results are different on BE and LE machines but generally it doesn't matter I think:
```diff
# s390x
>>> Ether(dst=ETHER_BROADCAST, src=RandMAC()).hashret()
b'\x90\x00'
```
```diff
# x86_64
>>> Ether(dst=ETHER_BROADCAST, src=RandMAC()).hashret()
b'\x00\x90'
```
They are compared in https://github.com/secdev/scapy/blob/5f0bb6c43530dcb2e1fb21d810cba9297e7ba1ca/test/scapy/layers/lltd.uts#L23 for example.

**Comment by evverx** [comment]
Before I forget below are all the test failures I was able to find after commenting out those tests one by one.
<details>
  <summary>test/scapy/layers/lltd.uts</summary>

```sh
LLTD regression tests for Scapy
━ Run at 06:15:11 from [test/scapy/layers/lltd.uts] by UTscapy in 0.5135774612426758
 └ Passed=3
 └ Failed=1

######
## LLTD protocol
######


###(001)=[failed] Packet build / dissection

>>> pkt = Ether(raw(Ether(dst=ETHER_BROADCAST, src=RandMAC()) / LLTD(tos=0, function=0)))
>>> assert LLTD in pkt
>>> assert pkt.dst == pkt.real_dst
>>> assert pkt.src == pkt.real_src
>>> assert pkt.tos == 0
>>> assert pkt.function == 0
>>> assert pkt.hashret() == b'\xd9\x88\x00\x00'
Traceback (most recent call last):
  File "<input>", line 2, in <module>
AssertionError
```
On s390x
```sh
>>> pkt.hashret()
b'\x88\xd9\x00\x00'
```
</details>

<details>
  <summary>test/contrib/coap.uts</summary>

```sh
CoAP layer test campaign
━ Run at 06:23:55 from [test/contrib/coap.uts] by UTscapy in 0.21637320518493652
 └ Passed=11
 └ Failed=1

######
## Test CoAP
######


###(005)=[failed] Extended option length

>>> assert raw(CoAP(options=[("Location-Path", 'x' * 280)])) == b'\x40\x00\x00\x00\x8e\x0b\x00' + b'\x78' * 280
Traceback (most recent call last):
  File "<input>", line 2, in <module>
AssertionError
```

On s390x
```sh
>>> raw(CoAP(options=[("Location-Path", 'x' * 280)]))
b'@\x00\x00\x00\x8e\x00\x0bxxxxxxxxxxxxxxxxxxxxxxxxxxxxxxxxxxxxxxxxxxxxxxxxxxxxxxxxxxxxxxxxxxxxxxxxxxxxxxxxxxxxxxxxxxxxxxxxxxxxxxxxxxxxxxxxxxxxxxxxxxxxxxxxxxxxxxxxxxxxxxxxxxxxxxxxxxxxxxxxxxxxxxxxxxxxxxxxxxxxxxxxxxxxxxxxxxxxxxxxxxxxxxxxxxxxxxxxxxxxxxxxxxxxxxxxxxxxxxxxxxxxxxxxxxxxxxxxxxxxxxxxxxxxxxxxxxxxxxxx'
```
</details>

<details>
  <summary>test/contrib/homeplugav.uts</summary>

```sh
━ Run at 06:31:53 from [test/contrib/homeplugav.uts] by UTscapy in 0.30486512184143066
 └ Passed=4
 └ Failed=1

######
## Basic tests
######
 Those test are here mainly to check nothing has been broken


###(004)=[failed] Testing length and checksum on a generated Write Module Data Request

>>> string = b"goodchoucroute\x00\x00"
>>> pkt = WriteModuleDataRequest(ModuleData=string)
>>> pkt = WriteModuleDataRequest(pkt.build())
>>> pkt.show()
###[ WriteModuleDataRequest ]###
  ModuleID  = PIB
  reserved_1= 0x0
  DataLen   = 4096
  Offset    = 0
  checksum  = 3975123099
  ModuleData= 'goodchoucroute\x00\x00'

>>> a = pkt.checksum == chksum32(pkt.ModuleData)
>>> b = pkt.DataLen == len(pkt.ModuleData)
>>> a, b
(False, False)
>>> assert a and b
Traceback (most recent call last):
  File "<input>", line 2, in <module>
AssertionError
```
On s390x
```sh
>>> pkt.checksum
3975123099
>>> chksum32(pkt.ModuleData)
2609967084
>>> pkt.DataLen
4096
>>> len(pkt.ModuleData)
16
```
</details>

<details>
  <summary>test/contrib/pcom.uts</summary>

```sh
PCOM tests
━ Run at 06:41:58 from [test/contrib/pcom.uts] by UTscapy in 0.21920323371887207
 └ Passed=2
 └ Failed=8

######
## Test PCOM/TCP
######


###(002)=[failed] PCOM/TCP Len

>>> r = b'\x65\x00\x04\x00\x00\x00\x00\x00'
>>> raw(PCOMRequest() / b'\x00\x00\x00\x00')[2:] == r
False
>>> r =  b'\x65\x00\x04\x00\x00\x00\x00\x00'
>>> raw(PCOMResponse() / b'\x00\x00\x00\x00')[2:] == r
False
```
On s390x
```
>>> raw(PCOMRequest() / b'\x00\x00\x00\x00')[2:]
b'e\x00\x00\x04\x00\x00\x00\x00'
>>> raw(PCOMResponse() / b'\x00\x00\x00\x00')[2:]
b'e\x00\x00\x04\x00\x00\x00\x00'
```

```sh
###(003)=[failed] PCOM/TCP Guess Payload Class

>>> assert isinstance(PCOMRequest(b'\x00\x00\x65\x00\x01\x00\x00\x00').payload, PCOMAsciiRequest)
>>> assert isinstance(PCOMResponse(b'\x00\x00\x65\x00\x01\x00\x00\x00').payload, PCOMAsciiResponse)
>>> assert isinstance(PCOMRequest(b'\x00\x00\x66\x00\x01\x00\x00\x00').payload, PCOMBinaryRequest)
>>> assert isinstance(PCOMResponse(b'\x00\x00\x66\x00\x01\x00\x00\x00').payload, PCOMBinaryResponse)


######
## Test PCOM/Ascii
######


###(004)=[failed] PCOM/ASCII Default values

>>> r = b'\x65\x00\x06\x00\x2f\x30\x30\x36\x30\x0d'
>>> raw(PCOMRequest() / PCOMAsciiRequest())[2:] == r
False
>>> r = b'\x65\x00\x07\x00\x2f\x41\x30\x30\x36\x30\x0d'
>>> raw(PCOMResponse() / PCOMAsciiResponse())[2:] == r
False


###(005)=[failed] PCOM/ASCII Checksum

>>> r = b'\x65\x00\x08\x00\x2f\x30\x30\x49\x44\x45\x44\x0d'
>>> raw(PCOMRequest() / PCOMAsciiRequest(unitId='00',command='ID'))[2:] == r
False
>>> r = b'\x65\x00\x09\x00\x2f\x41\x30\x30\x49\x44\x45\x44\x0d'
>>> raw(PCOMResponse() / PCOMAsciiResponse(unitId='00',command='ID'))[2:] == r
False


###(006)=[failed] PCOM/ASCII Known Codes

>>> f = PCOMAsciiCommandField('command', '',  length_from= None)
>>> assert f.i2repr(None, 'CCS') == 'Send Stop Command \'CCS\''
>>> assert f.i2repr(None, 'CC') == 'Reply of Admin Commands (CC*) \'CC\''


######
## Test PCOM/Binary
######


###(007)=[failed] PCOM/Binary Default values

>>> r = b'\x66\x00\x1b\x00\x2f\x5f\x4f\x50\x4c\x43\x00\xfe\x01\x00\x00\x00\x00\x00\
... \x00\x00\x00\x00\x00\x00\x00\x00\x45\xfd\x00\x00\x5c'
>>> raw(PCOMRequest(mode=0x66) / PCOMBinaryRequest())[2:] == r
False
>>> r = b'\x66\x00\x1b\x00\x2f\x5f\x4f\x50\x4c\x43\xfe\x00\x01\x00\x00\x00\x00\x00\
... \x00\x00\x00\x00\x00\x00\x00\x00\x45\xfd\x00\x00\x5c'
>>> raw(PCOMResponse(mode=0x66) / PCOMBinaryResponse())[2:] == r
False


###(008)=[failed] PCOM/Binary Checksum

>>> data = b'\x01\x00\x01\x01'
>>> r =  b'\x66\x00\x1f\x00\x2f\x5f\x4f\x50\x4c\x43\x00\xfe\x01\x01\x00\x00\x4d\x00\
... \x00\x00\x00\x00\x00\x01\x04\x00\xf2\xfc\x01\x00\x01\x01\xfd\xff\x5c'
>>> raw(PCOMRequest(mode=0x66) / PCOMBinaryRequest(command=0x4d,reserved3=0x01,
... commandSpecific='\x00\x00\x00\x00\x00\x01', len=4, data= data))[2:] == r
False
>>> r =  b'\x66\x00\x1f\x00\x2f\x5f\x4f\x50\x4c\x43\xfe\x00\x01\x01\x00\x00\x4d\x00\
... \x00\x00\x00\x00\x00\x01\x04\x00\xf2\xfc\x01\x00\x01\x01\xfd\xff\x5c'
>>> raw(PCOMResponse(mode=0x66) / PCOMBinaryResponse(command=0x4d,reserved3=0x01,
... commandSpecific='\x00\x00\x00\x00\x00\x01', len=4, data= data))[2:] == r
False


###(009)=[failed] PCOM/Binary Known Codes

>>> f = PCOMBinaryCommandField('command', None)
>>> assert f.i2repr(None, 0x4d) == 'Read Operands Request - 0x4d'
```
</details>

**Comment by evverx** [comment]
In the meantime I got the tests to run on various architectures including s390x in https://github.com/evverx/scapy/pull/1 so it should make it easier to test patches going forward. Apart from s390x the tests appear to be failing on i386 as well:
<details>
  <summary>OverflowError: timestamp out of range for platform time_t</summary>

```sh
######
## AutomotiveTestCaseExecutorConfiguration tests
######


###(038)=[failed] TestCase scan

>>> tc_executed = False
>>> 
>>> class GeneratedTestCase(MyTestCase):
...     def execute(self, socket, state, **kwargs):
...         assert kwargs["local_kwarg"] == "world"
...         global tc_executed
...         tc_executed = True
...         self._state_completed[state] = True
...         return True
... 
>>> 
>>> class TestCase43(MyTestCase, TestCaseGenerator):
...     def execute(self, socket, state, **kwargs):
...         self._state_completed[state] = True
...         return True
...     def get_generated_test_case(self):
...         return GeneratedTestCase()
... 
>>> 
>>> tce = Scanner(MockSock(), test_cases=[TestCase43],
...               GeneratedTestCase_kwargs={"local_kwarg": "world"})
>>> 
>>> assert len(tce.final_states) == 1
>>> assert len(tce.configuration.test_cases) == 1
>>> 
>>> tce.scan()
Traceback (most recent call last):
  File "<input>", line 2, in <module>
  File "/builddir/build/BUILD/scapy-2.5.0/scapy/contrib/automotive/scanner/executor.py", line 262, in scan
    log_automotive.debug("Set kill_time to %s" % time.ctime(kill_time))
OverflowError: timestamp out of range for platform time_t

```
</details>

My guess would be that it fails because `time_t` can't be larger than `2**31 - 1` there.

Anyway apparently the tests haven't been run on those architectures before (and for example Fedora doesn't run the tests at all to judge from https://src.fedoraproject.org/rpms/scapy/blob/rawhide/f/scapy.spec#_183) so it kind of snowballed into this. Some test failures should be easy to fix but for example the checksums in homeplugav aren't that obvious (to me at least).

**Comment by charles2910** [comment]
I'm going to give an update on Debian's side too.

We pushed a version with the fix (remove test) from #3848 and the patch for the s390x to experimental to see the test results. So far, only i386 and armel are done (from the failing ones). I'll update this comment with the logs as they become available - though I think @evverx already have them from his testings.

Regarding handling the endianness in the tests' assertions, couldn't you encode the assertion strings in runtime or re-encode the returned strings to a default endianness?

## armel test log
<details><summary>Log</summary>

```bash
######
## AutomotiveTestCaseExecutorConfiguration tests
######


###(038)=[failed] TestCase scan

[34m[1m>>> [0mtc_executed = False
[34m[1m>>> [0m
[34m[1m>>> [0mclass GeneratedTestCase(MyTestCase):
...     def execute(self, socket, state, **kwargs):
...         assert kwargs["local_kwarg"] == "world"
...         global tc_executed
...         tc_executed = True
...         self._state_completed[state] = True
...         return True
... 
[34m[1m>>> [0m
[34m[1m>>> [0mclass TestCase43(MyTestCase, TestCaseGenerator):
...     def execute(self, socket, state, **kwargs):
...         self._state_completed[state] = True
...         return True
...     def get_generated_test_case(self):
...         return GeneratedTestCase()
... 
[34m[1m>>> [0m
[34m[1m>>> [0mtce = Scanner(MockSock(), test_cases=[TestCase43],
...               GeneratedTestCase_kwargs={"local_kwarg": "world"})
[34m[1m>>> [0m
[34m[1m>>> [0massert len(tce.final_states) == 1
[34m[1m>>> [0massert len(tce.configuration.test_cases) == 1
[34m[1m>>> [0m
[34m[1m>>> [0mtce.scan()
Traceback (most recent call last):
  File "<input>", line 2, in <module>
  File "/tmp/autopkgtest-lxc.7d8x7nsw/downtmp/autopkgtest_tmp/src/scapy/contrib/automotive/scanner/executor.py", line 271, in scan
    log_automotive.debug("Set kill_time to %s" % time.ctime(kill_time))
                                                 ^^^^^^^^^^^^^^^^^^^^^
OverflowError: timestamp out of range for platform time_t



[31mUTscapy ended with error code 1[0m
```

</details>

## i386 tests log
<details><summary>Log</summary>

```bash
######
## AutomotiveTestCaseExecutorConfiguration tests
######


###(038)=[failed] TestCase scan

[34m[1m>>> [0mtc_executed = False
[34m[1m>>> [0m
[34m[1m>>> [0mclass GeneratedTestCase(MyTestCase):
...     def execute(self, socket, state, **kwargs):
...         assert kwargs["local_kwarg"] == "world"
...         global tc_executed
...         tc_executed = True
...         self._state_completed[state] = True
...         return True
... 
[34m[1m>>> [0m
[34m[1m>>> [0mclass TestCase43(MyTestCase, TestCaseGenerator):
...     def execute(self, socket, state, **kwargs):
...         self._state_completed[state] = True
...         return True
...     def get_generated_test_case(self):
...         return GeneratedTestCase()
... 
[34m[1m>>> [0m
[34m[1m>>> [0mtce = Scanner(MockSock(), test_cases=[TestCase43],
...               GeneratedTestCase_kwargs={"local_kwarg": "world"})
[34m[1m>>> [0m
[34m[1m>>> [0massert len(tce.final_states) == 1
[34m[1m>>> [0massert len(tce.configuration.test_cases) == 1
[34m[1m>>> [0m
[34m[1m>>> [0mtce.scan()
Traceback (most recent call last):
  File "<input>", line 2, in <module>
  File "/tmp/autopkgtest-lxc.fzlxk62o/downtmp/autopkgtest_tmp/src/scapy/contrib/automotive/scanner/executor.py", line 271, in scan
    log_automotive.debug("Set kill_time to %s" % time.ctime(kill_time))
                                                 ^^^^^^^^^^^^^^^^^^^^^
OverflowError: timestamp out of range for platform time_t



[31mUTscapy ended with error code 1[0m
```

</details>

**Comment by evverx** [comment]
> Regarding handling the endianness in the tests' assertions, couldn't you encode the assertion strings in runtime or re-encode the returned strings to a default endianness?

I think it depends on the tests. For example `assert pkt.hashret() == b'\xd9\x88\x00\x00'` in the lltd test can probably be replaced with something like
```
b'\x88\xd9\x00\x00' if BIG_ENDIAN else b'\xd9\x88\x00\x00'
```
but the coap test can't be fixed like that because it exposes an actual bug where the field that should be packed with `!H` is packed with `H` so the code itself should be fixed and the test should be adjusted to always expect the integer in network byte order. I'm not particularly familiar with homeplugav and pom (and I haven't read their specs closely yet) so it's hard to tell.

**Comment by evverx** [comment]
SPOM was easy enough. `LEShortField("len", None)` indicates that `len` should be little-endian so `post_build` should just pack it with `<H` explicitly. With that patch applied the SPOM test passes:
```diff
diff --git a/scapy/contrib/scada/pcom.py b/scapy/contrib/scada/pcom.py
index 533109cd..d8386a22 100755
--- a/scapy/contrib/scada/pcom.py
+++ b/scapy/contrib/scada/pcom.py
@@ -83,7 +83,7 @@ class PCOM(Packet):

     def post_build(self, pkt, pay):
         if self.len is None and pay:
-            pkt = pkt[:4] + struct.pack("H", len(pay))
+            pkt = pkt[:4] + struct.pack("<H", len(pay))
         return pkt + pay
```

**Comment by evverx** [comment]
FWIW I collected all the patches in https://github.com/evverx/scapy/pull/1/commits. I'm not sure whether they are suitable to be merged in general (and I left some comments in the commit messages) but at least s390x turned green finally: https://download.copr.fedorainfracloud.org/results/packit/evverx-scapy-1/fedora-36-s390x/05428623-scapy/builder-live.log.gz.

**Comment by evverx** [comment]
FWIW @charles2910 with https://github.com/secdev/scapy/pull/3887 merged the tests should pass on i386. I haven't run the tests on armel though but I think they should pass there too.

**Comment by charles2910** [comment]
Thanks for letting me know @evverx. I did the upload disabling tests in 32 bits and big endian for now because Debian's freeze is in place and we needed to migrate to testing ASAP (the failures were blocking it). As soon as the freeze is over and a new (minor ?) version of scapy is released, I'll package and re-enable the tests.

**Comment by evverx** [comment]
> As soon as the freeze is over and a new (minor ?) version of scapy is released, I'll package and re-enable the tests.

@charles2910 got it. Thanks! I think it would be great to bring the tests on those architectures eventually. They can help to catch issues that are really hard to spot.

Meanwhile apart from 32-bit machines now that all the "big-endian" commits have been merged the tests should pass on s390x as well. I think this issue can be closed.

**Comment by gpotter2** [comment]
> I think this issue can be closed.

Thanks.

**Comment by evverx** [comment]
For the record I run the scapy test suite on aarch64, i386, ppc64le, s390x and x86_64 regularly and it still passes there.

On a somewhat related note in terms of packaging the "samba-client", "samba" and "python3-tkinter" packages should be added to the list of build/test dependencies to get the test suite to pass with the master branch/next version of scapy

**Comment by gpotter2** [comment]
> For the record I run the scapy test suite on aarch64, i386, ppc64le, s390x and x86_64 regularly and it still passes there.

That's very cool. Is it possible/reasonable to integrate this in the CI, or is it too much resource-intensive / (or you` have to run those manually?)

> python3-tkinter

Hm, you are right but that's unwanted. This one should be optional, I'll PR some changes.

**Comment by evverx** [comment]
> Is it possible/reasonable to integrate this in the CI

It's possible to integrate it into the CI and the folks responsible for the testing infrastructure contacted me in https://github.com/evverx/scapy/pull/1#issuecomment-1420289145 offering help (and trying to figure out why I did it in a non-standard weird way :-)) The whole integration is one file https://github.com/evverx/scapy/pull/2/files and it runs the test suite automatically on all those arches on PRs/force-pushes. To set this up it should be hooked up to the repository using https://packit.dev/docs/guide#github. Once it's done it should work. I think it would be great if it was possible to integrate it upstream. It's kind of RPM-specific but I can fix it when it breaks. I do it anyway with my fork. I think the only problem is that I have nothing to do with the RedHat/Fedora package (and those distros in general) so I can't control how they edit their spec files but it's all fixable with a bunch of sed-commands anyway.

**Comment by charles2910** [comment]
Hey there, I've following the discussion and I missed this one:

> On a somewhat related note in terms of packaging the "samba-client", "samba" and "python3-tkinter" packages should be added to the list of build/test dependencies to get the test suite to pass with the master branch/next version of scapy

I do have a question though about the `smbclientserver.uts`. I'm packaging a snapshot of the master branch for reasons (supporting `python-cryptography >= 42`, see [#1067409](https://bugs.debian.org/cgi-bin/bugreport.cgi?bug=1067409)) and smbclientserver tests are timing out. I'm wondering if it's a limitation of the environment I'm running the tests (schroot) or if it might be a bug in scapy or samba. Could you guys give me a hand here?

<details><summary>Autopkgtest logs</summary>
<p>

```
SMB2 Client and Server tests
━ Run at 04:28:46 from [test/scapy/layers/smbclientserver.uts] by UTscapy in 17.82572913169861
 └ Passed=5
 └ Failed=5

######
## SMB2 Client tests
######


###(001)=[failed] smbclient: connect then list shares

>>> with run_smbserver():
...    try:
...       cli = run_smbclient()
...       results = cli.shares()
...       print(results)
...       assert ('test', 'DISKTREE', 'Test share') in results
...       assert any(x[0] == "IPC$" for x in results)
...    finally:
...       cli.close()
...
@ Starting smbd server
@ Server started !
Starting control thread [tid=140005375342272]
## state=[BEGIN]
Condition [continue_smb2] not taken
Condition [send_negotiate] taken to state [SENT_NEGOTIATE]
   + Running action [on_negotiate]
SENT : DirectTCP / SMB_Header / SMBNegotiate_Request
switching from [BEGIN] to [SENT_NEGOTIATE]
## state=[SENT_NEGOTIATE]
Stopping control thread (tid=140005375342272)
@ Stopping smbd server !

Test failed. Smbd logs:
[2024/03/23 04:28:28.724838,  0] source3/smbd/server.c:1746(main)
  smbd version 4.19.5-Debian started.
  Copyright Andrew Tridgell and the Samba Team 1992-2023
[2024/03/23 04:28:28.728109,  1] source3/profile/profile.c:49(set_profile_level)
  INFO: Profiling turned OFF from pid 257574
[2024/03/23 04:28:28.737263,  1] source3/passdb/pdb_tdb.c:540(tdbsam_open)
  tdbsam_open: Converting version 0.0 database to version 4.0.
[2024/03/23 04:28:28.737408,  1] source3/passdb/pdb_tdb.c:305(tdbsam_convert_backup)
  tdbsam_convert_backup: updated /tmp/scapyb3uq36xm/private/passdb.tdb file.
[2024/03/23 04:28:29.173125,  3] source3/smbd/smb2_negprot.c:1133(smb2_multi_protocol_reply_negprot)
  Requested protocol [PC NETWORK PROGRAM 1.0]
[2024/03/23 04:28:29.173181,  3] source3/smbd/smb2_negprot.c:1133(smb2_multi_protocol_reply_negprot)
  Requested protocol [LANMAN1.0]
[2024/03/23 04:28:29.173195,  3] source3/smbd/smb2_negprot.c:1133(smb2_multi_protocol_reply_negprot)
  Requested protocol [Windows for Workgroups 3.1a]
[2024/03/23 04:28:29.173203,  3] source3/smbd/smb2_negprot.c:1133(smb2_multi_protocol_reply_negprot)
  Requested protocol [LM1.2X002]
[2024/03/23 04:28:29.173210,  3] source3/smbd/smb2_negprot.c:1133(smb2_multi_protocol_reply_negprot)
  Requested protocol [LANMAN2.1]
[2024/03/23 04:28:29.173217,  3] source3/smbd/smb2_negprot.c:1133(smb2_multi_protocol_reply_negprot)
  Requested protocol [NT LM 0.12]
[2024/03/23 04:28:29.173225,  3] source3/smbd/smb2_negprot.c:1133(smb2_multi_protocol_reply_negprot)
  Requested protocol [SMB 2.002]
[2024/03/23 04:28:29.173232,  3] source3/smbd/smb2_negprot.c:1133(smb2_multi_protocol_reply_negprot)
  Requested protocol [SMB 2.???]
[2024/03/23 04:28:29.173415,  3] source3/smbd/smb2_negprot.c:345(smbd_smb2_request_process_negprot)
  Selected protocol SMB2_FF

@ smbd server stopped !
Traceback (most recent call last):
  File "<input>", line 4, in <module>
  File "<input>", line 3, in run_smbclient
  File "/tmp/autopkgtest.ac4XGh/autopkgtest_tmp/src/scapy/layers/smbclient.py", line 952, in __init__
    self.smbsock = SMB_SOCKET(self.sock)
                   ^^^^^^^^^^^^^^^^^^^^^
  File "/tmp/autopkgtest.ac4XGh/autopkgtest_tmp/src/scapy/layers/smbclient.py", line 485, in __init__
    raise TimeoutError(
TimeoutError: The SMB handshake timed out ! (enable debug=1 for logs)

During handling of the above exception, another exception occurred:

Traceback (most recent call last):
  File "<input>", line 10, in <module>
NameError: name 'cli' is not defined


###(002)=[failed] smbclient: connect to test share and list files

>>> with run_smbserver():
...    try:
...       cli = run_smbclient()
...       cli.use("test")
...       files = cli.ls()
...       names = [x[0] for x in files]
...       assert all(x in names for x in ['.', '..', 'sub', 'fileB', 'fileScapy', 'fileA'])
...    finally:
...       cli.close()
...
@ Starting smbd server
@ Server started !
Starting control thread [tid=140005375342272]
## state=[BEGIN]
Condition [continue_smb2] not taken
Condition [send_negotiate] taken to state [SENT_NEGOTIATE]
   + Running action [on_negotiate]
SENT : DirectTCP / SMB_Header / SMBNegotiate_Request
switching from [BEGIN] to [SENT_NEGOTIATE]
## state=[SENT_NEGOTIATE]
Stopping control thread (tid=140005375342272)
@ Stopping smbd server !

Test failed. Smbd logs:
[2024/03/23 04:28:32.247052,  0] source3/smbd/server.c:1746(main)
  smbd version 4.19.5-Debian started.
  Copyright Andrew Tridgell and the Samba Team 1992-2023
[2024/03/23 04:28:32.249314,  1] source3/profile/profile.c:49(set_profile_level)
  INFO: Profiling turned OFF from pid 257602
[2024/03/23 04:28:32.691677,  3] source3/smbd/smb2_negprot.c:1133(smb2_multi_protocol_reply_negprot)
  Requested protocol [PC NETWORK PROGRAM 1.0]
[2024/03/23 04:28:32.691721,  3] source3/smbd/smb2_negprot.c:1133(smb2_multi_protocol_reply_negprot)
  Requested protocol [LANMAN1.0]
[2024/03/23 04:28:32.691730,  3] source3/smbd/smb2_negprot.c:1133(smb2_multi_protocol_reply_negprot)
  Requested protocol [Windows for Workgroups 3.1a]
[2024/03/23 04:28:32.691739,  3] source3/smbd/smb2_negprot.c:1133(smb2_multi_protocol_reply_negprot)
  Requested protocol [LM1.2X002]
[2024/03/23 04:28:32.691745,  3] source3/smbd/smb2_negprot.c:1133(smb2_multi_protocol_reply_negprot)
  Requested protocol [LANMAN2.1]
[2024/03/23 04:28:32.691751,  3] source3/smbd/smb2_negprot.c:1133(smb2_multi_protocol_reply_negprot)
  Requested protocol [NT LM 0.12]
[2024/03/23 04:28:32.691757,  3] source3/smbd/smb2_negprot.c:1133(smb2_multi_protocol_reply_negprot)
  Requested protocol [SMB 2.002]
[2024/03/23 04:28:32.691762,  3] source3/smbd/smb2_negprot.c:1133(smb2_multi_protocol_reply_negprot)
  Requested protocol [SMB 2.???]
[2024/03/23 04:28:32.691883,  3] source3/smbd/smb2_negprot.c:345(smbd_smb2_request_process_negprot)
  Selected protocol SMB2_FF
[2024/03/23 04:28:34.902880,  3] auth/gensec/gensec_start.c:1083(gensec_register)
  GENSEC backend 'gssapi_spnego' registered
[2024/03/23 04:28:34.902955,  3] auth/gensec/gensec_start.c:1083(gensec_register)
  GENSEC backend 'gssapi_krb5' registered
[2024/03/23 04:28:34.902978,  3] auth/gensec/gensec_start.c:1083(gensec_register)
  GENSEC backend 'gssapi_krb5_sasl' registered
[2024/03/23 04:28:34.902995,  3] auth/gensec/gensec_start.c:1083(gensec_register)
  GENSEC backend 'spnego' registered
[2024/03/23 04:28:34.903013,  3] auth/gensec/gensec_start.c:1083(gensec_register)
  GENSEC backend 'schannel' registered
[2024/03/23 04:28:34.903031,  3] auth/gensec/gensec_start.c:1083(gensec_register)
  GENSEC backend 'ncalrpc_as_system' registered
[2024/03/23 04:28:34.903048,  3] auth/gensec/gensec_start.c:1083(gensec_register)
  GENSEC backend 'sasl-EXTERNAL' registered
[2024/03/23 04:28:34.903066,  3] auth/gensec/gensec_start.c:1083(gensec_register)
  GENSEC backend 'ntlmssp' registered
[2024/03/23 04:28:34.903083,  3] auth/gensec/gensec_start.c:1083(gensec_register)
  GENSEC backend 'ntlmssp_resume_ccache' registered
[2024/03/23 04:28:34.903101,  3] auth/gensec/gensec_start.c:1083(gensec_register)
  GENSEC backend 'http_basic' registered
[2024/03/23 04:28:34.903118,  3] auth/gensec/gensec_start.c:1083(gensec_register)
  GENSEC backend 'http_ntlm' registered
[2024/03/23 04:28:34.903135,  3] auth/gensec/gensec_start.c:1083(gensec_register)
  GENSEC backend 'http_negotiate' registered
[2024/03/23 04:28:34.903159,  3] auth/gensec/gensec_start.c:1083(gensec_register)
  GENSEC backend 'krb5' registered
[2024/03/23 04:28:34.903178,  3] auth/gensec/gensec_start.c:1083(gensec_register)
  GENSEC backend 'fake_gssapi_krb5' registered
[2024/03/23 04:28:34.903674,  3] source3/smbd/smb2_negprot.c:1198(smb2_multi_protocol_reply_negprot)
  Selected protocol SMB 2.???
[2024/03/23 04:28:34.903718,  5] source3/smbd/smb2_negprot.c:1200(smb2_multi_protocol_reply_negprot)
  smb2_multi_protocol_reply_negprot: negprot index=7

@ smbd server stopped !
Traceback (most recent call last):
  File "<input>", line 4, in <module>
  File "<input>", line 3, in run_smbclient
  File "/tmp/autopkgtest.ac4XGh/autopkgtest_tmp/src/scapy/layers/smbclient.py", line 952, in __init__
    self.smbsock = SMB_SOCKET(self.sock)
                   ^^^^^^^^^^^^^^^^^^^^^
  File "/tmp/autopkgtest.ac4XGh/autopkgtest_tmp/src/scapy/layers/smbclient.py", line 485, in __init__
    raise TimeoutError(
TimeoutError: The SMB handshake timed out ! (enable debug=1 for logs)

During handling of the above exception, another exception occurred:

Traceback (most recent call last):
  File "<input>", line 10, in <module>
NameError: name 'cli' is not defined


###(003)=[failed] smbclient: connect to test share and get file

>>> LOCALPATH = pathlib.Path(get_temp_dir())
>>>
>>> with run_smbserver():
...    try:
...       cli = run_smbclient()
...       cli.use("test")
...       cli.lcd(str(LOCALPATH))
...       completions = cli.get_complete("file")
...       assert all(x in completions for x in ['fileA', 'fileB'])
...       cli.get('fileA')
...       assert (LOCALPATH / "fileA").exists()
...       assert [x.name for x in cli.lls()] == ['fileA']
...    finally:
...       cli.close()
...
@ Starting smbd server
@ Server started !
Starting control thread [tid=140005375342272]
## state=[BEGIN]
Condition [continue_smb2] not taken
Condition [send_negotiate] taken to state [SENT_NEGOTIATE]
   + Running action [on_negotiate]
SENT : DirectTCP / SMB_Header / SMBNegotiate_Request
switching from [BEGIN] to [SENT_NEGOTIATE]
## state=[SENT_NEGOTIATE]
Stopping control thread (tid=140005375342272)
@ Stopping smbd server !

Test failed. Smbd logs:
[2024/03/23 04:28:35.759666,  0] source3/smbd/server.c:1746(main)
  smbd version 4.19.5-Debian started.
  Copyright Andrew Tridgell and the Samba Team 1992-2023
[2024/03/23 04:28:35.763423,  1] source3/profile/profile.c:49(set_profile_level)
  INFO: Profiling turned OFF from pid 257638
[2024/03/23 04:28:36.202357,  3] source3/smbd/smb2_negprot.c:1133(smb2_multi_protocol_reply_negprot)
  Requested protocol [PC NETWORK PROGRAM 1.0]
[2024/03/23 04:28:36.202422,  3] source3/smbd/smb2_negprot.c:1133(smb2_multi_protocol_reply_negprot)
  Requested protocol [LANMAN1.0]
[2024/03/23 04:28:36.202440,  3] source3/smbd/smb2_negprot.c:1133(smb2_multi_protocol_reply_negprot)
  Requested protocol [Windows for Workgroups 3.1a]
[2024/03/23 04:28:36.202457,  3] source3/smbd/smb2_negprot.c:1133(smb2_multi_protocol_reply_negprot)
  Requested protocol [LM1.2X002]
[2024/03/23 04:28:36.202471,  3] source3/smbd/smb2_negprot.c:1133(smb2_multi_protocol_reply_negprot)
  Requested protocol [LANMAN2.1]
[2024/03/23 04:28:36.202484,  3] source3/smbd/smb2_negprot.c:1133(smb2_multi_protocol_reply_negprot)
  Requested protocol [NT LM 0.12]
[2024/03/23 04:28:36.202496,  3] source3/smbd/smb2_negprot.c:1133(smb2_multi_protocol_reply_negprot)
  Requested protocol [SMB 2.002]
[2024/03/23 04:28:36.202509,  3] source3/smbd/smb2_negprot.c:1133(smb2_multi_protocol_reply_negprot)
  Requested protocol [SMB 2.???]
[2024/03/23 04:28:36.202724,  3] source3/smbd/smb2_negprot.c:345(smbd_smb2_request_process_negprot)
  Selected protocol SMB2_FF
[2024/03/23 04:28:38.480846,  3] auth/gensec/gensec_start.c:1083(gensec_register)
  GENSEC backend 'gssapi_spnego' registered
[2024/03/23 04:28:38.480887,  3] auth/gensec/gensec_start.c:1083(gensec_register)
  GENSEC backend 'gssapi_krb5' registered
[2024/03/23 04:28:38.480898,  3] auth/gensec/gensec_start.c:1083(gensec_register)
  GENSEC backend 'gssapi_krb5_sasl' registered
[2024/03/23 04:28:38.480907,  3] auth/gensec/gensec_start.c:1083(gensec_register)
  GENSEC backend 'spnego' registered
[2024/03/23 04:28:38.480915,  3] auth/gensec/gensec_start.c:1083(gensec_register)
  GENSEC backend 'schannel' registered
[2024/03/23 04:28:38.480923,  3] auth/gensec/gensec_start.c:1083(gensec_register)
  GENSEC backend 'ncalrpc_as_system' registered
[2024/03/23 04:28:38.480931,  3] auth/gensec/gensec_start.c:1083(gensec_register)
  GENSEC backend 'sasl-EXTERNAL' registered
[2024/03/23 04:28:38.480938,  3] auth/gensec/gensec_start.c:1083(gensec_register)
  GENSEC backend 'ntlmssp' registered
[2024/03/23 04:28:38.480946,  3] auth/gensec/gensec_start.c:1083(gensec_register)
  GENSEC backend 'ntlmssp_resume_ccache' registered
[2024/03/23 04:28:38.480954,  3] auth/gensec/gensec_start.c:1083(gensec_register)
  GENSEC backend 'http_basic' registered
[2024/03/23 04:28:38.480962,  3] auth/gensec/gensec_start.c:1083(gensec_register)
  GENSEC backend 'http_ntlm' registered
[2024/03/23 04:28:38.480970,  3] auth/gensec/gensec_start.c:1083(gensec_register)
  GENSEC backend 'http_negotiate' registered
[2024/03/23 04:28:38.480981,  3] auth/gensec/gensec_start.c:1083(gensec_register)
  GENSEC backend 'krb5' registered
[2024/03/23 04:28:38.480989,  3] auth/gensec/gensec_start.c:1083(gensec_register)
  GENSEC backend 'fake_gssapi_krb5' registered
[2024/03/23 04:28:38.481238,  3] source3/smbd/smb2_negprot.c:1198(smb2_multi_protocol_reply_negprot)
  Selected protocol SMB 2.???
[2024/03/23 04:28:38.481258,  5] source3/smbd/smb2_negprot.c:1200(smb2_multi_protocol_reply_negprot)
  smb2_multi_protocol_reply_negprot: negprot index=7

@ smbd server stopped !
Traceback (most recent call last):
  File "<input>", line 4, in <module>
  File "<input>", line 3, in run_smbclient
  File "/tmp/autopkgtest.ac4XGh/autopkgtest_tmp/src/scapy/layers/smbclient.py", line 952, in __init__
    self.smbsock = SMB_SOCKET(self.sock)
                   ^^^^^^^^^^^^^^^^^^^^^
  File "/tmp/autopkgtest.ac4XGh/autopkgtest_tmp/src/scapy/layers/smbclient.py", line 485, in __init__
    raise TimeoutError(
TimeoutError: The SMB handshake timed out ! (enable debug=1 for logs)

During handling of the above exception, another exception occurred:

Traceback (most recent call last):
  File "<input>", line 13, in <module>
NameError: name 'cli' is not defined


###(004)=[failed] smbclient: connect to test share, cd, put file and cat it

>>> LOCALPATH = pathlib.Path(get_temp_dir())
>>> with (LOCALPATH / "fileC").open("w") as fd:
...    fd.write("Nice\nData")
...
9
>>> with run_smbserver():
...    try:
...       cli = run_smbclient()
...       cli.use("test")
...       cli.lcd(str(LOCALPATH))
...       cli.cd("sub")
...       # upload
...       cli.put('fileC')
...       # check completion
...       completions = cli.get_complete("")
...       assert all(x in completions for x in ['secret', 'fileC'])
...       # cat
...       assert cli.cat('fileC') == b'Nice\nData'
...       # check on disk
...       with (SHARE_DIR / "sub" / "fileC").open("r") as fd:
...          assert fd.read() == "Nice\nData"
...    finally:
...       cli.close()
...
@ Starting smbd server
@ Server started !
Starting control thread [tid=140005375342272]
## state=[BEGIN]
Condition [continue_smb2] not taken
Condition [send_negotiate] taken to state [SENT_NEGOTIATE]
   + Running action [on_negotiate]
SENT : DirectTCP / SMB_Header / SMBNegotiate_Request
switching from [BEGIN] to [SENT_NEGOTIATE]
## state=[SENT_NEGOTIATE]
Stopping control thread (tid=140005375342272)
@ Stopping smbd server !

Test failed. Smbd logs:
[2024/03/23 04:28:39.258004,  0] source3/smbd/server.c:1746(main)
  smbd version 4.19.5-Debian started.
  Copyright Andrew Tridgell and the Samba Team 1992-2023
[2024/03/23 04:28:39.260401,  1] source3/profile/profile.c:49(set_profile_level)
  INFO: Profiling turned OFF from pid 257683
[2024/03/23 04:28:39.721864,  3] source3/smbd/smb2_negprot.c:1133(smb2_multi_protocol_reply_negprot)
  Requested protocol [PC NETWORK PROGRAM 1.0]
[2024/03/23 04:28:39.721909,  3] source3/smbd/smb2_negprot.c:1133(smb2_multi_protocol_reply_negprot)
  Requested protocol [LANMAN1.0]
[2024/03/23 04:28:39.721919,  3] source3/smbd/smb2_negprot.c:1133(smb2_multi_protocol_reply_negprot)
  Requested protocol [Windows for Workgroups 3.1a]
[2024/03/23 04:28:39.721929,  3] source3/smbd/smb2_negprot.c:1133(smb2_multi_protocol_reply_negprot)
  Requested protocol [LM1.2X002]
[2024/03/23 04:28:39.721936,  3] source3/smbd/smb2_negprot.c:1133(smb2_multi_protocol_reply_negprot)
  Requested protocol [LANMAN2.1]
[2024/03/23 04:28:39.721942,  3] source3/smbd/smb2_negprot.c:1133(smb2_multi_protocol_reply_negprot)
  Requested protocol [NT LM 0.12]
[2024/03/23 04:28:39.721948,  3] source3/smbd/smb2_negprot.c:1133(smb2_multi_protocol_reply_negprot)
  Requested protocol [SMB 2.002]
[2024/03/23 04:28:39.721954,  3] source3/smbd/smb2_negprot.c:1133(smb2_multi_protocol_reply_negprot)
  Requested protocol [SMB 2.???]
[2024/03/23 04:28:39.722080,  3] source3/smbd/smb2_negprot.c:345(smbd_smb2_request_process_negprot)
  Selected protocol SMB2_FF
[2024/03/23 04:28:41.637629,  3] auth/gensec/gensec_start.c:1083(gensec_register)
  GENSEC backend 'gssapi_spnego' registered
[2024/03/23 04:28:41.637696,  3] auth/gensec/gensec_start.c:1083(gensec_register)
  GENSEC backend 'gssapi_krb5' registered
[2024/03/23 04:28:41.637717,  3] auth/gensec/gensec_start.c:1083(gensec_register)
  GENSEC backend 'gssapi_krb5_sasl' registered
[2024/03/23 04:28:41.637733,  3] auth/gensec/gensec_start.c:1083(gensec_register)
  GENSEC backend 'spnego' registered
[2024/03/23 04:28:41.637750,  3] auth/gensec/gensec_start.c:1083(gensec_register)
  GENSEC backend 'schannel' registered
[2024/03/23 04:28:41.637765,  3] auth/gensec/gensec_start.c:1083(gensec_register)
  GENSEC backend 'ncalrpc_as_system' registered
[2024/03/23 04:28:41.637781,  3] auth/gensec/gensec_start.c:1083(gensec_register)
  GENSEC backend 'sasl-EXTERNAL' registered
[2024/03/23 04:28:41.637797,  3] auth/gensec/gensec_start.c:1083(gensec_register)
  GENSEC backend 'ntlmssp' registered
[2024/03/23 04:28:41.637812,  3] auth/gensec/gensec_start.c:1083(gensec_register)
  GENSEC backend 'ntlmssp_resume_ccache' registered
[2024/03/23 04:28:41.637829,  3] auth/gensec/gensec_start.c:1083(gensec_register)
  GENSEC backend 'http_basic' registered
[2024/03/23 04:28:41.637845,  3] auth/gensec/gensec_start.c:1083(gensec_register)
  GENSEC backend 'http_ntlm' registered
[2024/03/23 04:28:41.637860,  3] auth/gensec/gensec_start.c:1083(gensec_register)
  GENSEC backend 'http_negotiate' registered
[2024/03/23 04:28:41.637882,  3] auth/gensec/gensec_start.c:1083(gensec_register)
  GENSEC backend 'krb5' registered
[2024/03/23 04:28:41.637898,  3] auth/gensec/gensec_start.c:1083(gensec_register)
  GENSEC backend 'fake_gssapi_krb5' registered
[2024/03/23 04:28:41.638360,  3] source3/smbd/smb2_negprot.c:1198(smb2_multi_protocol_reply_negprot)
  Selected protocol SMB 2.???
[2024/03/23 04:28:41.638398,  5] source3/smbd/smb2_negprot.c:1200(smb2_multi_protocol_reply_negprot)
  smb2_multi_protocol_reply_negprot: negprot index=7

@ smbd server stopped !
Traceback (most recent call last):
  File "<input>", line 4, in <module>
  File "<input>", line 3, in run_smbclient
  File "/tmp/autopkgtest.ac4XGh/autopkgtest_tmp/src/scapy/layers/smbclient.py", line 952, in __init__
    self.smbsock = SMB_SOCKET(self.sock)
                   ^^^^^^^^^^^^^^^^^^^^^
  File "/tmp/autopkgtest.ac4XGh/autopkgtest_tmp/src/scapy/layers/smbclient.py", line 485, in __init__
    raise TimeoutError(
TimeoutError: The SMB handshake timed out ! (enable debug=1 for logs)

During handling of the above exception, another exception occurred:

Traceback (most recent call last):
  File "<input>", line 19, in <module>
NameError: name 'cli' is not defined


###(005)=[failed] smbclient: connect to test share and recursive get

>>> LOCALPATH = pathlib.Path(get_temp_dir())
>>>
>>> with run_smbserver():
...    try:
...       cli = run_smbclient()
...       cli.use("test")
...       cli.lcd(str(LOCALPATH))
...       cli.get(".", r=True)
...       # check on disk
...    finally:
...       cli.close()
...
@ Starting smbd server
@ Server started !
Starting control thread [tid=140005375342272]
## state=[BEGIN]
Condition [continue_smb2] not taken
Condition [send_negotiate] taken to state [SENT_NEGOTIATE]
   + Running action [on_negotiate]
SENT : DirectTCP / SMB_Header / SMBNegotiate_Request
switching from [BEGIN] to [SENT_NEGOTIATE]
## state=[SENT_NEGOTIATE]
Stopping control thread (tid=140005375342272)
@ Stopping smbd server !

Test failed. Smbd logs:
[2024/03/23 04:28:42.791670,  0] source3/smbd/server.c:1746(main)
  smbd version 4.19.5-Debian started.
  Copyright Andrew Tridgell and the Samba Team 1992-2023
[2024/03/23 04:28:42.795324,  1] source3/profile/profile.c:49(set_profile_level)
  INFO: Profiling turned OFF from pid 257725
[2024/03/23 04:28:43.230046,  3] source3/smbd/smb2_negprot.c:1133(smb2_multi_protocol_reply_negprot)
  Requested protocol [PC NETWORK PROGRAM 1.0]
[2024/03/23 04:28:43.230094,  3] source3/smbd/smb2_negprot.c:1133(smb2_multi_protocol_reply_negprot)
  Requested protocol [LANMAN1.0]
[2024/03/23 04:28:43.230104,  3] source3/smbd/smb2_negprot.c:1133(smb2_multi_protocol_reply_negprot)
  Requested protocol [Windows for Workgroups 3.1a]
[2024/03/23 04:28:43.230114,  3] source3/smbd/smb2_negprot.c:1133(smb2_multi_protocol_reply_negprot)
  Requested protocol [LM1.2X002]
[2024/03/23 04:28:43.230121,  3] source3/smbd/smb2_negprot.c:1133(smb2_multi_protocol_reply_negprot)
  Requested protocol [LANMAN2.1]
[2024/03/23 04:28:43.230128,  3] source3/smbd/smb2_negprot.c:1133(smb2_multi_protocol_reply_negprot)
  Requested protocol [NT LM 0.12]
[2024/03/23 04:28:43.230135,  3] source3/smbd/smb2_negprot.c:1133(smb2_multi_protocol_reply_negprot)
  Requested protocol [SMB 2.002]
[2024/03/23 04:28:43.230142,  3] source3/smbd/smb2_negprot.c:1133(smb2_multi_protocol_reply_negprot)
  Requested protocol [SMB 2.???]
[2024/03/23 04:28:43.230284,  3] source3/smbd/smb2_negprot.c:345(smbd_smb2_request_process_negprot)
  Selected protocol SMB2_FF
[2024/03/23 04:28:45.637009,  3] auth/gensec/gensec_start.c:1083(gensec_register)
  GENSEC backend 'gssapi_spnego' registered
[2024/03/23 04:28:45.637045,  3] auth/gensec/gensec_start.c:1083(gensec_register)
  GENSEC backend 'gssapi_krb5' registered
[2024/03/23 04:28:45.637055,  3] auth/gensec/gensec_start.c:1083(gensec_register)
  GENSEC backend 'gssapi_krb5_sasl' registered
[2024/03/23 04:28:45.637064,  3] auth/gensec/gensec_start.c:1083(gensec_register)
  GENSEC backend 'spnego' registered
[2024/03/23 04:28:45.637072,  3] auth/gensec/gensec_start.c:1083(gensec_register)
  GENSEC backend 'schannel' registered
[2024/03/23 04:28:45.637079,  3] auth/gensec/gensec_start.c:1083(gensec_register)
  GENSEC backend 'ncalrpc_as_system' registered
[2024/03/23 04:28:45.637087,  3] auth/gensec/gensec_start.c:1083(gensec_register)
  GENSEC backend 'sasl-EXTERNAL' registered
[2024/03/23 04:28:45.637095,  3] auth/gensec/gensec_start.c:1083(gensec_register)
  GENSEC backend 'ntlmssp' registered
[2024/03/23 04:28:45.637103,  3] auth/gensec/gensec_start.c:1083(gensec_register)
  GENSEC backend 'ntlmssp_resume_ccache' registered
[2024/03/23 04:28:45.637111,  3] auth/gensec/gensec_start.c:1083(gensec_register)
  GENSEC backend 'http_basic' registered
[2024/03/23 04:28:45.637119,  3] auth/gensec/gensec_start.c:1083(gensec_register)
  GENSEC backend 'http_ntlm' registered
[2024/03/23 04:28:45.637127,  3] auth/gensec/gensec_start.c:1083(gensec_register)
  GENSEC backend 'http_negotiate' registered
[2024/03/23 04:28:45.637138,  3] auth/gensec/gensec_start.c:1083(gensec_register)
  GENSEC backend 'krb5' registered
[2024/03/23 04:28:45.637146,  3] auth/gensec/gensec_start.c:1083(gensec_register)
  GENSEC backend 'fake_gssapi_krb5' registered
[2024/03/23 04:28:45.637397,  3] source3/smbd/smb2_negprot.c:1198(smb2_multi_protocol_reply_negprot)
  Selected protocol SMB 2.???
[2024/03/23 04:28:45.637417,  5] source3/smbd/smb2_negprot.c:1200(smb2_multi_protocol_reply_negprot)
  smb2_multi_protocol_reply_negprot: negprot index=7

@ smbd server stopped !
Traceback (most recent call last):
  File "<input>", line 4, in <module>
  File "<input>", line 3, in run_smbclient
  File "/tmp/autopkgtest.ac4XGh/autopkgtest_tmp/src/scapy/layers/smbclient.py", line 952, in __init__
    self.smbsock = SMB_SOCKET(self.sock)
                   ^^^^^^^^^^^^^^^^^^^^^
  File "/tmp/autopkgtest.ac4XGh/autopkgtest_tmp/src/scapy/layers/smbclient.py", line 485, in __init__
    raise TimeoutError(
TimeoutError: The SMB handshake timed out ! (enable debug=1 for logs)

During handling of the above exception, another exception occurred:

Traceback (most recent call last):
  File "<input>", line 10, in <module>
NameError: name 'cli' is not defined



UTscapy ended with error code 1
```

The test definition is:

```bash
./test/run_tests -c test/configs/linux.utsc -K tcpdump \
                                            -K manufdb \
                                            -K wireshark \
                                            -K ci_only \
                                            -K vcan_socket \
                                            -K automotive_comm \
                                            -K imports \
                                            -K scanner \
                                            -K netaccess \
                                            -K root \
                                            -K tshark \
                                            -K brotli \
                                            -K zstd
```
</p>
</details>

**Comment by evverx** [comment]
@charles2910 could you open a new issue? This thread is already huge and the comment can get lost here.

**Comment by evverx** [comment]
FWIW I ran this test in a Debian container (outside of the autopkgtest environment) and it passed there so it seems it has something to do with the autopkgtest environment.

**Comment by charles2910** [comment]
@evverx I see your point, but I didn't want to create a new issue in scapy if autopkgtest is the one to blame.

I tested autopkgtest with different backends (chroot, schroot, incus - vm and container) and it failed in all of them. Since it passed in your test, I really think it's an autopkgtest issue - and I'll report this issue to autopkgtest.

If you really want to dive in, I can open a new issue in scapy too.

**Comment by gpotter2** [comment]
Hi. I'm really interested to understand what's happening, as the SMB stack (and in this case, smb client) is very new code.

The logs you've shown seems to indicate it's timing out after the first packet, which samba sees and tries to answer to. Could be a firewall issue on `lo`, could be a Scapy bug, could be a samba bug. I'm a bit surprised to not see much more, considering I've already enabled rather high logging levels for both Scapy and samba for those tests.

How does one get its hands on a working, somewhat debuggable `autopkgtest` environment?

**Comment by gpotter2** [comment]
Off topic note: in your command I'd replace `-K root` with `-K needs_root`. Seems to be a mistake (maybe mine?).
