### ISSUE TITLE
TCP MD5 hash calculated incorrectly

### ISSUE THREAD

**Issue by DresslerFrank** [secdev/scapy#5174]
### Brief description

The curent code does not correctly compute the hash of the TCP MD5 option.

According to [RFC2385](https://www.rfc-editor.org/info/rfc2385/), `tcpdump`, and the Linux kernel, the TCP options must be skipped when hashing the packet, while their lengths still affect the result through the segment length in the TCP pseudo header and data offset in the TCP header, both of which are part of the hash input.

### Scapy version

251daecbd3f4e91f437908332cc17a517305674e

### Python version

3.14.7

### Operating system

Arch Linux 7.2.3-arch1-3

### How to reproduce

* `tcpdump` with `-M ...` configuring the key used to verify the MD5 checksum
  ```sh
  sudo tcpdump -tlnni lo -M 12345678 tcp port 9999
  ````

* `Python3/scapy` to forge and send packets with the same key (`12345678`) used above
  ```py
  pkt = IPv6(dst="::1")/TCP(dport=9999)
  sign_tcp_md5(pkt[TCP], b"12345678")
  send(pkt)

  pkt = IP(dst="127.0.0.1")/TCP(dport=9999)
  sign_tcp_md5(pkt[TCP], b"12345678")
  send(pkt)
  ```

### Actual result

```sh
IP6 ::1.20 > ::1.9999: Flags [S], seq 0, win 8192, options [md5  (invalid),eol], length 0                                                                                                                                                                                                  
IP 127.0.0.1.20 > 127.0.0.1.9999: Flags [S], seq 0, win 8192, options [md5  (invalid),eol], length 0
```

The `md5  (invalid)` is the problem.

### Expected result

```
IP6 ::1.20 > ::1.9999: Flags [S], seq 0, win 8192, options [md5 valid,eol], length 0
IP 127.0.0.1.20 > 127.0.0.1.9999: Flags [S], seq 0, win 8192, options [md5 valid,eol], length 0
```

The `md5 valid` is what you should see.

**Comment by DresslerFrank** [comment]
@Ts-Boom This issue already has a working fix with #5175.

Good you tried to fix it as well but your fix does not work.

It is not sufficient to just skip the options. Both segment length and data offset influence the hashing result and depend on the presence of the TCP MD5 option which is why the hash must be computed as if that option had already been added. That is what my change is doing on top of what yours is doing.

You cannot really have tested your change because you would have noticed that both `tcpdump` and the kernel would rejected your packets because of an invalid signature in the packet. Since you also did not update the tests, that mistake was not caught. But how could you update the test if you did not even properly test the change?

You say that you created your change without AI. However, your change contains an AI-like amount of comments in the code and also contains the character `—` (Unicode codpoint `8212`) which is suspicious.

**Comment by Ts-Boom** [comment]
Hi @DresslerFrank, thanks for the candid feedback. You are absolutely
right. I completely missed #5175 while looking into the issue, and my
approach naively overlooked the segment length and data offset
dependencies. Your explanation makes total sense.

I also appreciate you pointing out the gaps in my testing process and the
styling/comment fluff; it's a solid lesson learned. I'm closing this PR in
favor of yours. Great work on the proper fix.

19 Eyl 2026 Cmt, saat 15:02 tarihinde Frank Dressler <
***@***.***> şunu yazdı:
