### ISSUE TITLE
sniff() displays packets twice

### ISSUE THREAD

**Issue by randomshell** [secdev/scapy#1702]
#### Brief description

Sending a TCP (Raw) packet with `send() ` and sniffing it results in same packet being displayed twice.

Tested with tcpdump and even if it says `2 packets received by filter`, importing the pcap in scapy and listing packets shows correctly only one. It appears to be an issue with the output of scapy `sniff()`.

#### Environment

- Scapy version: `pypi 2.4.0 and git 2.4.0.dev581`
- Python version: `3.6`
- Fedora 28

#### How to reproduce

Code used for sending:
```
text = "hi"
a = IP(src="192.168.0.3", dst="127.0.0.1")/TCP(sport=RandShort(), dport=1234)/Raw(load=text)
send(a)
```
Code used for sniffing, where the same packet is displayed twice:
```
sniff(filter="tcp port 1234", iface="lo", prn=lambda x:x.summary())
```

#### Actual result

Output:
```
Ether / IP / TCP 192.168.0.3:7975 > 127.0.0.1:1234 S / Raw
Ether / IP / TCP 192.168.0.3:7975 > 127.0.0.1:1234 S / Raw
```

#### Expected result

Output:
```
Ether / IP / TCP 192.168.0.3:7975 > 127.0.0.1:1234 S / Raw
```

**Comment by p-l-** [comment]
Hi,

Thanks for reporting your issue!

The loopback interface is not a "real" interface and have some weird behaviours when used with raw sockets.

Can you reproduce this issue with another interface?

**Comment by p-l-** [comment]
I'm not sure to understand. What happens if you send a packet to an IP over you wlan network (say, your gateway), while you sniff on your wlan interface, using `iface="your iface"`?

**Comment by randomshell** [comment]
My bad.
Indeed, it shows only one packet as it should.

I was interested in getting the packet shown once, if it works on other interfaces but not on localhost it's fine for me. And as you are already aware of issues on loopback, feel free to close this issue.
Thank you for your help.

Edit: it seems that I missed the FAQ "I can’t ping 127.0.0.1. Scapy does not work with 127.0.0.1 or on the loopback interface
", maybe because I was expecting to not work at all, not working wrong. The description clarifies everything though.

**Comment by p-l-** [comment]
Perfect, so I'm closing this issue. Thanks anyway for your report!
