### ISSUE TITLE
Problem with capture filter

### ISSUE THREAD

**Issue by 9maf4you** [secdev/scapy#55]
Hello!
I try to catch DHCPv6 packet by port. I use this filter:
`sn = sniff(filter="port 546 or 547")`
But what i see every time:

```
0000 Ether / IPv6 / TCP src_ipv_6:ssh > dest_ipv_6:49553 PA / Raw
0001 Ether / IPv6 / UDP src_ipv_6:dhcpv6_server > dest_ipv_6:dhcpv6_server / DHCP6_RelayReply / DHCP6OptUnknown
0002 Ether / IPv6 / UDP src_ipv_6:dhcpv6_server > dest_ipv_6:dhcpv6_server / DHCP6_RelayReply / DHCP6OptUnknown

```

There is one tcp-packet with different port.

```
>>> sn[0].sport
22
>>> sn[0].dport
49553
```

and i see only replyes.

```
>>> sn[2].msgtype
13
>>> sn[1].msgtype
13
```

But if i run tcpdump with same filter i will see that suppose and without the tcp-packet :)

```
tcpdump -n -i any -w /tmp/git.pcap port '(546 or 547)'
```

```
15:37:59.472643 IP6 src_ipv_6.547 > dest_ipv_6.547: dhcp6 relay-fwd
15:37:59.472897 IP6 src_ipv_6.547 > dest_ipv_6.547: dhcp6 relay-reply
15:37:59.830144 IP6 src_ipv_6.547 > dest_ipv_6.547: dhcp6 relay-fwd
15:37:59.830357 IP6 src_ipv_6.547 > dest_ipv_6.547: dhcp6 relay-reply
```

```
dpkg -l python-scapy | grep ii
ii  python-scapy                            2.2.0-1                              all          Packet generator/sniffer and network scanner/discovery
```

```
python --version
Python 2.7.6
```

```
lsb_release -dc
Description:    Ubuntu 14.04.3 LTS
Codename:       trusty

```

is it not a bug?

Thank you.

**Comment by p-l-** [comment]
This is a bug. I think this is related to [issue #5115 on Bitbucket](https://bitbucket.org/secdev/scapy/issues/5115).

Can you check if this bug still happens with the current development code? Thanks!

**Comment by 9maf4you** [comment]
Yes, first problem has been resolved.
But i still don't see _dhcp6 relay-fwd_ packets.

Scapy (2.3.2-dev)
Thank you!

**Comment by p-l-** [comment]
Hi,

Can you create (with tcpdump) a PCAP file of packets including some that are **not** seen by Scapy with the filter set?

**Comment by 9maf4you** [comment]
Sorry, I can't.
When i read a PCAP file using scapy ( that has been caught by tcpdump ) i can see all of these packets.

**Comment by p-l-** [comment]
That's normal. But I'd like to send the packets on a network to see if I can see them with Scapy `sniff()` with the filter set.

**Comment by 9maf4you** [comment]
i've sent PCAP file to your email the domain is @droids-corp.org and the recipient is pierre.

**Comment by p-l-** [comment]
@9maf4you thanks, I'll have a look.

**Comment by p-l-** [comment]
I cannot reproduce your bug based on the capture file you have sent me. When I send the packets, and sniff with scapy, with the filter set, I get the packets.

Are you sure both Scapy and tcpdump were running at the same time and in the same conditions?

**Comment by 9maf4you** [comment]
Pierre, thank you for your help.
I have just checked it again with similar filters. 
`tcpdump -i any port 546 or 547`
`sniff(filter="port 546 or 547", prn = lambda x: x.summary())`
And i still have had same problem.
Can i run scapy in debug-mode?

**Comment by p-l-** [comment]
OK. Can you specify the interface, both on Scapy and tcpdump? (e.g., `tcpdump -i eth0 ...` and `sniff(iface="eth0", ...)`)?

About debugging Scapy, the thing is, the `filter` is set on the socket and then Scapy has no control over it.

One thing you can do is to check that, if you implement the `filter` as a Scapy `lfilter`, you get all the packets. For that, try `sniff(lfilter=lambda p: any(proto in p and (p[proto].sport in [546, 547] or p[proto].dport in [546, 547]) for proto in [TCP, UDP]))`.

Of course, this is not a solution to the bug, only a way to understand more about it.

**Comment by p-l-** [comment]
Closing for no activity. Please re-open if needed.
