### ISSUE TITLE
Wrong Packet Send Timestamp used in PCAP Generation - A Solution Identified

### ISSUE THREAD

**Issue by rwhalb** [secdev/scapy#2427]
#### Brief description
I have installed the latest commit of scapy with the "Rework Timestamp Detection" commit: 
[#2401](https://github.com/secdev/scapy/commit/90c8d82070a9edaf0bbfe53b00db8dcf13154eed)

I have determined that PCAP generation using the utility function: "wrpcap" is using the wrong send timestamp for packet capture file creation.
#### Environment

-   Scapy version: `v2.4.3-237.g90c8d820`
-   Python version: `e.g. 3.7`
-   Operating System: `e.g. Fedora 30 (NST 30)`

#### How to reproduce

Use the "wrpcap" to write out a sequence of send  / receive packets. A sequence of packets was generated using TCP Sync with TTL range from 1 to 2 and was sent out using sr().

#### Actual Results

Below is the resultant pcap file decoded by tshark.

```
/sbin/tshark -C "Default" -n -t r -r "/var/nst/wuiout/mtraceroute/capture_file.cap";
    1   0.000000 10.222.222.10 → 172.217.12.164 TCP 51620 → 80 [SYN] Seq=0 Win=8192 Len=0 MSS=1460 TSval=1579617777 TSecr=0 WS=128
    2   0.000000 10.222.222.10 → 172.217.12.164 TCP 62087 → 443 [SYN] Seq=0 Win=8192 Len=0 MSS=1460 TSval=1579617777 TSecr=0 WS=128
    3   0.000397 10.222.222.1 → 10.222.222.10 ICMP Time-to-live exceeded (Time to live exceeded in transit)
    4   0.002344 10.222.222.1 → 10.222.222.10 ICMP Time-to-live exceeded (Time to live exceeded in transit)
```
You can see that both packets 1 and 2 (Sent Packets) have the same timestamp. I believe this is the packet creation time and not the sent time.

#### The Problem Area and Solution

After debugging I found that the wrong timestamp is being used for sent packets. Normally I would submit a Pull Request. But in this case I am only solving for the Linux platform and I am uncertain if the fix will be the permanent solution.

In file "utils.py"  I am determining if the "sent_time" attribute exists (I.e., A send packet) and is a float value for function: "_write_packet" in Class: "PcapWriter". If so, set the "usec" var to this value. Otherwise use the "time" attribute (I.e. A recevice packet).

Before:
```
        if hasattr(packet, "time"):
            if sec is None:
                sec = int(packet.time)
                usec = int(round((packet.time - sec) *
                                 (1000000000 if self.nano else 1000000)))
        if usec is None:
            usec = 0
```
After:
```
        if hasattr(packet, "sent_time") and isinstance(packet.sent_time, float):
            if sec is None:
                sec = int(packet.sent_time)
                usec = int(round((packet.sent_time - sec) *
                                 (1000000000 if self.nano else 1000000)))
        else:
            if hasattr(packet, "time"):
                if sec is None:
                    sec = int(packet.time)
                    usec = int(round((packet.time - sec) *
                                     (1000000000 if self.nano else 1000000)))
        if usec is None:
            usec = 0
```

#### Expected result

After the modification is in place the following are the results:

```
/sbin/tshark -C "Default" -n -t r -r "/var/nst/wuiout/mtraceroute/capture_file.cap";
    1   0.000000 10.222.222.10 → 172.217.12.164 TCP 51620 → 80 [SYN] Seq=0 Win=8192 Len=0 MSS=1460 TSval=1579617777 TSecr=0 WS=128
    2   0.000397 10.222.222.1 → 10.222.222.10 ICMP Time-to-live exceeded (Time to live exceeded in transit)
    3   0.002043 10.222.222.10 → 172.217.12.164 TCP 62087 → 443 [SYN] Seq=0 Win=8192 Len=0 MSS=1460 TSval=1579617777 TSecr=0 WS=128
    4   0.002344 10.222.222.1 → 10.222.222.10 ICMP Time-to-live exceeded (Time to live exceeded in transit)
```
Now the TCP Sync packets that are sent from scapy are timestamped with the "sent_time" and the received packet use the "time" timestamp.

---Ron Henderson
CoAuthor of NST (Network Security Toolkit)

**Comment by gpotter2** [comment]
Unlike the other bug you submitted, this one is arguable.

I'm not sure if that wouldn't be considered "by-design". If feels weird to me that one would use the sent time when available. If people want to change the time, they can `pkt.time = pkt.sent_time`

```
a = IP(dst="google.com")/ICMP()
wrpcap("a.pcap", a)
sr1(a)
wrpcap("b.pcap", a)
```
would write two different timestamps. That looks very unintuitive..

**Comment by rwhalb** [comment]
I can use the `pkt.time = pkt.sent_time` idea. But if you have generated a sequence of packets for sending / receiving like this:

```
for i in range(1, 100):
    a = IP(dst=dest) / TCP(flags="S", seq=i, sport=65000+i, dport=55556)
    pkt.append(a)
ans, unans = sr(pkt, filter="host {0}".format(dest), inter=0, timeout=10.0, verbose=1, promisc=True)
wrpcap("a.pcap", ans)
```

All 100 send packets would all have the same timestamp (I.e. the packet creation timestamp) for the sent packets in the pcap file. It would be impossible to generate round-trip-times from sent times in this case. The received timestamp would be correct.  

I have checked this with a simultaneous running packet capture using "dumpcap". When the correct send timestamps are used, It was quite impressive to see that scapy had a consistent 20 microsecond absolute timestamp offset for send / receive times. This is far within the margin of error for a off the shelf X86_64 system. 

So now I will have to do this:
```
spkts = []
rpkts = []
pkts = []
for pkt in ans:
    spkts += [t[0] for t in ans]
    rpkts += [t[1] for t in ans]
for sp in spkts:
    sp.time = sp.sent_time                                  # Get packet sent time
pkts = spkts + rpkts
wrpcap("a.pcap", pkts)
```
If we implemented my solution this can be written:
```
pkts = []
for pkt in ans:
    pkts += [t[0] for t in ans] + [t[1] for t in ans]
wrpcap("a.pcap", pkts)
```
One then needs to reorder the packets in the capture file using: `/usr/sbin/reordercap` on the generated pcap file: "a.pcap". Now "a.pcap" is a very usable pcap file scapy generated.

---Ron Henderson

**Comment by gpotter2** [comment]
How about
```diff
diff --git a/scapy/plist.py b/scapy/plist.py
index d3f05eb5..850b6f81 100644
--- a/scapy/plist.py
+++ b/scapy/plist.py
@@ -696,6 +696,12 @@ class SndRcvList(PacketList):
         # type: (...) -> None
         PacketList.__init__(self, res, name, stats)
 
+    def __iter__(self):
+        for s, r in self.res:
+            s.time = s.sent_time
+            yield s
+            yield r
+
     def _elt2pkt(self, elt):
         # type: (Tuple[Packet, Packet]) -> Packet
         return elt[1]
diff --git a/scapy/utils.py b/scapy/utils.py
index 0c797bac..aabf79a8 100644
--- a/scapy/utils.py
+++ b/scapy/utils.py
@@ -1365,12 +1365,7 @@ class RawPcapWriter:
                 self._write_header(pkt)
             self._write_packet(pkt)
         else:
-            # Import here to avoid a circular dependency
-            from scapy.plist import SndRcvList
-            if isinstance(pkt, SndRcvList):
-                pkt = (p for t in pkt for p in t)
-            else:
-                pkt = pkt.__iter__()
+            pkt = pkt.__iter__()
             for p in pkt:
 
                 if not self.header_present:
```

You can just `wrpcap()` the list sr gave you.

**Comment by rwhalb** [comment]
I am not familiar with generator functions. So questions:

1) Does this modification only set the time attribute for sent packets not the receive ones?

2) Does this also set the unanswered sent packets with their corresponding sent time from the results of the sr() function?

**Comment by gpotter2** [comment]
This patch will change the time during the `[s[0] for s in ans]` iteration, for sent packets only. It sounds reasonable (you won't need to change those timestamps afterwards like above)

**Comment by rwhalb** [comment]
My vote is if it is a send packet sent out on the wire via scapy then the send timestamp should be the "sent_time" value whether the send packet is associated with an answered received packet or an unanswered sent packet. It should not be the creation time of the packet.
