### ISSUE TITLE
Traceroute packet timings do not reflect reality

### ISSUE THREAD

**Issue by robobeaver6** [secdev/scapy#2640]
#### Brief description
I am trying to calculate the hop times for a TCP traceroute. I enumerate the results, but for each result, when I calculate the delta between the send and recieve I get a much larger value than I do if I look at the deltas in a wireshark capture.

#### Environment

-   Scapy version: 2.4.3 (also tried 2.4.2)
-   Python version: 3.7
-   Operating System: Windows 10
-   npcap: 0.9991

#### How to reproduce
Using the Target `1.1.1.1`
```
result, unans = traceroute(target, dport=443, minttl=1, maxttl=10)
for i, r in enumerate(result):
    diff = r[1].time - r[0].sent_time
    print(f"{i} - {r[1].src} - {diff}")
```
I have tried with both `.time` and `.sent_time`
#### Actual result
```
Scapy Traceroute
Begin emission:
Finished sending 10 packets.
**********
Received 10 packets, got 10 answers, remaining 0 packets
   1.1.1.1:tcp443     
1  192.168.1.254   11 
2  62.3.80.17      11 
3  62.3.80.38      11 
4  5.57.81.75      11 
5  1.1.1.1         SA 
6  1.1.1.1         SA 
7  1.1.1.1         SA 
8  1.1.1.1         SA 
9  1.1.1.1         SA 
10 1.1.1.1         SA 
0 - 192.168.1.254 - 0.049866676330566406
1 - 62.3.80.17 - 0.04986715316772461
2 - 62.3.80.38 - 0.04886960983276367
3 - 1.1.1.1 - 0.04886960983276367
4 - 1.1.1.1 - 0.047872304916381836
5 - 1.1.1.1 - 0.047872304916381836
6 - 5.57.81.75 - 0.04986691474914551
7 - 1.1.1.1 - 0.047872066497802734
8 - 1.1.1.1 - 0.047872066497802734
9 - 1.1.1.1 - 0.0468747615814209
```
Whereas the PCAP timings from Wireshark show:
```
No.	Time		Delta		Protocol	Time to live	Source			Destination		Info	
1	0.000000	0.000000	TCP			1				192.168.1.25	1.1.1.1			64154 → 443 [SYN] Seq=0 Win=8192 Len=0	
2	0.000308	0.000308	ICMP		64,1			192.168.1.254	192.168.1.25	Time-to-live exceeded (Time to live exceeded in transit)	
3	0.000719	0.000411	TCP			2				192.168.1.25	1.1.1.1			40060 → 443 [SYN] Seq=0 Win=8192 Len=0	
4	0.001447	0.000728	TCP			3				192.168.1.25	1.1.1.1			59179 → 443 [SYN] Seq=0 Win=8192 Len=0	
5	0.002219	0.000772	TCP			4				192.168.1.25	1.1.1.1			32109 → 443 [SYN] Seq=0 Win=8192 Len=0	
6	0.002930	0.000711	TCP			5				192.168.1.25	1.1.1.1			27697 → 443 [SYN] Seq=0 Win=8192 Len=0	
7	0.003703	0.000773	TCP			6				192.168.1.25	1.1.1.1			24519 → 443 [SYN] Seq=0 Win=8192 Len=0	
8	0.004482	0.000779	TCP			7				192.168.1.25	1.1.1.1			20087 → 443 [SYN] Seq=0 Win=8192 Len=0	
9	0.005217	0.000735	TCP			8				192.168.1.25	1.1.1.1			15351 → 443 [SYN] Seq=0 Win=8192 Len=0	
10	0.005969	0.000752	TCP			9				192.168.1.25	1.1.1.1			61928 → 443 [SYN] Seq=0 Win=8192 Len=0	
11	0.006661	0.000692	TCP			10				192.168.1.25	1.1.1.1			33937 → 443 [SYN] Seq=0 Win=8192 Len=0	
12	0.013661	0.007000	ICMP		254,0			62.3.80.17		192.168.1.25	Time-to-live exceeded (Time to live exceeded in transit)	
13	0.014761	0.001100	ICMP		253,1			62.3.80.38		192.168.1.25	Time-to-live exceeded (Time to live exceeded in transit)	
14	0.017055	0.002294	TCP			56				1.1.1.1			192.168.1.25	443 → 27697 [SYN, ACK] Seq=0 Ack=1 Win=65535 Len=0 MSS=1452	
15	0.017081	0.000026	TCP			128				192.168.1.25	1.1.1.1			27697 → 443 [RST] Seq=1 Win=0 Len=0	
16	0.017510	0.000429	TCP			56				1.1.1.1			192.168.1.25	443 → 24519 [SYN, ACK] Seq=0 Ack=1 Win=65535 Len=0 MSS=1452	
17	0.017527	0.000017	TCP			128				192.168.1.25	1.1.1.1			24519 → 443 [RST] Seq=1 Win=0 Len=0	
18	0.018437	0.000910	TCP			56				1.1.1.1			192.168.1.25	443 → 20087 [SYN, ACK] Seq=0 Ack=1 Win=65535 Len=0 MSS=1452	
19	0.018452	0.000015	TCP			128				192.168.1.25	1.1.1.1			20087 → 443 [RST] Seq=1 Win=0 Len=0		
20	0.018965	0.000513	ICMP		248,1			5.57.81.75		192.168.1.25	Time-to-live exceeded (Time to live exceeded in transit)	
21	0.020034	0.001069	TCP			56				1.1.1.1			192.168.1.25	443 → 61928 [SYN, ACK] Seq=0 Ack=1 Win=65535 Len=0 MSS=1452	
22	0.020050	0.000016	TCP			128				192.168.1.25	1.1.1.1			61928 → 443 [RST] Seq=1 Win=0 Len=0	
23	0.020060	0.000010	TCP			56				1.1.1.1			192.168.1.25	443 → 15351 [SYN, ACK] Seq=0 Ack=1 Win=65535 Len=0 MSS=1452	
24	0.020069	0.000009	TCP			128				192.168.1.25	1.1.1.1			15351 → 443 [RST] Seq=1 Win=0 Len=0	
25	0.021200	0.001131	TCP			56				1.1.1.1			192.168.1.25	443 → 33937 [SYN, ACK] Seq=0 Ack=1 Win=65535 Len=0 MSS=1452	
26	0.021215	0.000015	TCP			128				192.168.1.25	1.1.1.1			33937 → 443 [RST] Seq=1 Win=0 Len=0		
```

#### Expected result
I would expect similar results to Wireshark

**Comment by gpotter2** [comment]
Could you retry against the github version?
We fixed an issue with timestamps on layer 3 recently.

**Comment by robobeaver6** [comment]
I tried with 2.4.3.dev554 and it is much better.  Within a few µs if I use `.sent_time`.  The difference between `r[0].time` and `r[0].sent_time` seems to be around 40ms +-6.  I am not quite clear what `.time` is a timestamp of.  `.sent_time` is pretty clear from the name.

**Comment by gpotter2** [comment]
The code you're using in your first post is correct.
`time` is either the received time or the time of creation of the packet. `sent_time` is explicit.
If this helped you feel free to close the jssue

**Comment by gpotter2** [comment]
I consider this fixed in master.
