### ISSUE TITLE
snd.ttl returned by sr() seems to wrong

### ISSUE THREAD

**Issue by cunzhihuang** [secdev/scapy#3239]
#### Brief description
snd.ttl returned by sr() seems to wrong

#### Environment

-   Scapy version:  2.4.5
-   Python version: 3.8.7
-   Operating System: Windows 10 

#### How to reproduce
From the interactive shell, run the following and note the 1st column (no gap) and the last line.
>>> ans, unans = sr(IP(dst='74.6.231.20', ttl=(1, 30),id=RandShort())/TCP(flags=0x2, dport=443), timeout=1)
Begin emission:
Finished sending 30 packets.
.*......****........*................********...........
Received 56 packets, got 14 answers, remaining 16 packets
>>> for snd,rcv in ans:
...:     print (snd.ttl, rcv.src, isinstance(rcv.payload, TCP))
...:
1 192.168.1.1 False
2 96.120.91.25 False
3 96.110.176.177 False
4 162.151.78.253 False
5 68.86.143.93 False
6 4.68.72.105 False
7 4.59.251.50 False
8 98.138.51.5 False
9 98.138.97.157 False
10 209.191.64.222 False
11 98.138.97.75 False
12 74.6.231.20 True
13 74.6.231.20 True
14 216.115.105.183 False

Now run the following and compare.
>>> ans, unans = traceroute('74.6.231.20', maxttl=30, timeout=1, dport=443)
Begin emission:
Finished sending 30 packets.
*********************
Received 21 packets, got 21 answers, remaining 9 packets
   74.6.231.20:tcp443
1  192.168.1.1     11
2  96.120.91.25    11
3  96.110.176.177  11
4  162.151.78.253  11
5  68.86.143.93    11
6  4.68.72.105     11
8  4.59.251.50     11
9  209.191.64.220  11
10 216.115.105.29  11
11 98.138.97.67    11
12 98.138.51.2     11
13 98.138.97.156   11
22 74.6.231.20     SA
23 74.6.231.20     SA
24 74.6.231.20     SA
25 74.6.231.20     SA
26 74.6.231.20     SA
27 74.6.231.20     SA
28 74.6.231.20     SA
29 74.6.231.20     SA
30 74.6.231.20     SA

#### Expected result
snd.ttl has correct value.
Workaround: Use random sport.  It may be helpful to add some notes to https://scapy.readthedocs.io/en/latest/usage.html#tcp-traceroute.

**Comment by qupfer** [comment]
The ttl seems correct or at least its the one of the stored source package. 
```
>>> p = IP(dst='74.6.231.20', ttl=(1,30),id=RandShort())/TCP(flags=0x2)
>>> plist=[ap for ap in p ]
>>> plist
[<IP  id=19941 frag=0 ttl=1 proto=tcp dst=74.6.231.20 |<TCP  flags=S |>>,
 <IP  id=42998 frag=0 ttl=2 proto=tcp dst=74.6.231.20 |<TCP  flags=S |>>,
 <IP  id=53385 frag=0 ttl=3 proto=tcp dst=74.6.231.20 |<TCP  flags=S |>>,
 <IP  id=29690 frag=0 ttl=4 proto=tcp dst=74.6.231.20 |<TCP  flags=S |>>,
 <IP  id=48912 frag=0 ttl=5 proto=tcp dst=74.6.231.20 |<TCP  flags=S |>>,
 <IP  id=18275 frag=0 ttl=6 proto=tcp dst=74.6.231.20 |<TCP  flags=S |>>,
 <IP  id=31017 frag=0 ttl=7 proto=tcp dst=74.6.231.20 |<TCP  flags=S |>>,
 <IP  id=12550 frag=0 ttl=8 proto=tcp dst=74.6.231.20 |<TCP  flags=S |>>,
 <IP  id=22393 frag=0 ttl=9 proto=tcp dst=74.6.231.20 |<TCP  flags=S |>>,
 <IP  id=34031 frag=0 ttl=10 proto=tcp dst=74.6.231.20 |<TCP  flags=S |>>,
 <IP  id=52447 frag=0 ttl=11 proto=tcp dst=74.6.231.20 |<TCP  flags=S |>>,
 <IP  id=41544 frag=0 ttl=12 proto=tcp dst=74.6.231.20 |<TCP  flags=S |>>,
 <IP  id=44698 frag=0 ttl=13 proto=tcp dst=74.6.231.20 |<TCP  flags=S |>>,
 <IP  id=9854 frag=0 ttl=14 proto=tcp dst=74.6.231.20 |<TCP  flags=S |>>,
 <IP  id=54161 frag=0 ttl=15 proto=tcp dst=74.6.231.20 |<TCP  flags=S |>>,
 <IP  id=3482 frag=0 ttl=16 proto=tcp dst=74.6.231.20 |<TCP  flags=S |>>,
 <IP  id=4853 frag=0 ttl=17 proto=tcp dst=74.6.231.20 |<TCP  flags=S |>>,
 <IP  id=17105 frag=0 ttl=18 proto=tcp dst=74.6.231.20 |<TCP  flags=S |>>,
 <IP  id=11098 frag=0 ttl=19 proto=tcp dst=74.6.231.20 |<TCP  flags=S |>>,
 <IP  id=37494 frag=0 ttl=20 proto=tcp dst=74.6.231.20 |<TCP  flags=S |>>,
 <IP  id=20582 frag=0 ttl=21 proto=tcp dst=74.6.231.20 |<TCP  flags=S |>>,
 <IP  id=5724 frag=0 ttl=22 proto=tcp dst=74.6.231.20 |<TCP  flags=S |>>,
 <IP  id=33467 frag=0 ttl=23 proto=tcp dst=74.6.231.20 |<TCP  flags=S |>>,
 <IP  id=37236 frag=0 ttl=24 proto=tcp dst=74.6.231.20 |<TCP  flags=S |>>,
 <IP  id=4094 frag=0 ttl=25 proto=tcp dst=74.6.231.20 |<TCP  flags=S |>>,
 <IP  id=50005 frag=0 ttl=26 proto=tcp dst=74.6.231.20 |<TCP  flags=S |>>,
 <IP  id=2228 frag=0 ttl=27 proto=tcp dst=74.6.231.20 |<TCP  flags=S |>>,
 <IP  id=55672 frag=0 ttl=28 proto=tcp dst=74.6.231.20 |<TCP  flags=S |>>,
 <IP  id=63353 frag=0 ttl=29 proto=tcp dst=74.6.231.20 |<TCP  flags=S |>>,
 <IP  id=7537 frag=0 ttl=30 proto=tcp dst=74.6.231.20 |<TCP  flags=S |>>]
>>> ans,unans = sr(plist,timeout=1)
Begin emission:
Finished sending 30 packets.
.******************....
Received 23 packets, got 18 answers, remaining 12 packets
>>> for p,pp in ans:
...:     print(f'{p.id}: {p.ttl}'))
...: 
...: 
...: 
...: 
19941: 1
42998: 2
53385: 3
29690: 4
48912: 5
18275: 6
31017: 7
12550: 8
22393: 9
34031: 10
52447: 11
41544: 12
44698: 13
9854: 14
54161: 15
3482: 16
4853: 17
17105: 18
>>> 
>>> ans.show()
0000 IP / TCP 192.168.178.3:ftp_data > 74.6.231.20:www_http S ==> IP / ICMP 192.168.178.1 > 192.168.178.3 time-exceeded ttl-zero-during-transit / IPerror / TCPerror
0001 IP / TCP 192.168.178.3:ftp_data > 74.6.231.20:www_http S ==> IP / ICMP 83.169.181.246 > 192.168.178.3 time-exceeded ttl-zero-during-transit / IPerror / TCPerror
0002 IP / TCP 192.168.178.3:ftp_data > 74.6.231.20:www_http S ==> IP / ICMP 77.22.6.254 > 192.168.178.3 time-exceeded ttl-zero-during-transit / IPerror / TCPerror
0003 IP / TCP 192.168.178.3:ftp_data > 74.6.231.20:www_http S ==> IP / ICMP 77.22.6.254 > 192.168.178.3 time-exceeded ttl-zero-during-transit / IPerror / TCPerror
0004 IP / TCP 192.168.178.3:ftp_data > 74.6.231.20:www_http S ==> IP / ICMP 88.134.192.236 > 192.168.178.3 time-exceeded ttl-zero-during-transit / IPerror / TCPerror / Padding
0005 IP / TCP 192.168.178.3:ftp_data > 74.6.231.20:www_http S ==> IP / ICMP 145.254.3.128 > 192.168.178.3 time-exceeded ttl-zero-during-transit / IPerror / TCPerror / Padding
0006 IP / TCP 192.168.178.3:ftp_data > 74.6.231.20:www_http S ==> IP / ICMP 80.81.192.115 > 192.168.178.3 time-exceeded ttl-zero-during-transit / IPerror / TCPerror
0007 IP / TCP 192.168.178.3:ftp_data > 74.6.231.20:www_http S ==> IP / ICMP 209.191.112.7 > 192.168.178.3 time-exceeded ttl-zero-during-transit / IPerror / TCPerror / Padding
0008 IP / TCP 192.168.178.3:ftp_data > 74.6.231.20:www_http S ==> IP / ICMP 209.191.112.25 > 192.168.178.3 time-exceeded ttl-zero-during-transit / IPerror / TCPerror / Padding
0009 IP / TCP 192.168.178.3:ftp_data > 74.6.231.20:www_http S ==> IP / ICMP 209.191.64.24 > 192.168.178.3 time-exceeded ttl-zero-during-transit / IPerror / TCPerror / Padding
0010 IP / TCP 192.168.178.3:ftp_data > 74.6.231.20:www_http S ==> IP / ICMP 209.191.64.39 > 192.168.178.3 time-exceeded ttl-zero-during-transit / IPerror / TCPerror / Padding
0011 IP / TCP 192.168.178.3:ftp_data > 74.6.231.20:www_http S ==> IP / ICMP 209.191.64.218 > 192.168.178.3 time-exceeded ttl-zero-during-transit / IPerror / TCPerror
0012 IP / TCP 192.168.178.3:ftp_data > 74.6.231.20:www_http S ==> IP / ICMP 216.115.105.27 > 192.168.178.3 time-exceeded ttl-zero-during-transit / IPerror / TCPerror
0013 IP / TCP 192.168.178.3:ftp_data > 74.6.231.20:www_http S ==> IP / ICMP 98.138.51.3 > 192.168.178.3 time-exceeded ttl-zero-during-transit / IPerror / TCPerror
0014 IP / TCP 192.168.178.3:ftp_data > 74.6.231.20:www_http S ==> IP / ICMP 98.138.97.65 > 192.168.178.3 time-exceeded ttl-zero-during-transit / IPerror / TCPerror
0015 IP / TCP 192.168.178.3:ftp_data > 74.6.231.20:www_http S ==> IP / ICMP 98.138.97.156 > 192.168.178.3 time-exceeded ttl-zero-during-transit / IPerror / TCPerror
0016 IP / TCP 192.168.178.3:ftp_data > 74.6.231.20:www_http S ==> IP / TCP 74.6.231.20:www_http > 192.168.178.3:ftp_data SA / Padding
0017 IP / TCP 192.168.178.3:ftp_data > 74.6.231.20:www_http S ==> IP / TCP 74.6.231.20:www_http > 192.168.178.3:ftp_data SA / Padding
```

What I think, is that the time between two sending packages is two short. 
So the answers are matched to the wrong (earlier) sended packages. 

If you look at the [traceroute implementation](https://gist.github.com/amitsaha/8879445), you see that every package is checked BEFORE the next one is send.
