### ISSUE TITLE
on-the-wire packet length lost

### ISSUE THREAD

**Issue by jonesrick** [secdev/scapy#1083]
[scapyd.pcap.gz](https://github.com/secdev/scapy/files/1656955/scapyd.pcap.gz)

[orig.pcap.gz](https://github.com/secdev/scapy/files/1656954/orig.pcap.gz)
If one reads-in a pcap and then writes it out again, the on-the-wire packet length field of the per-packet pcap header gets set to the snaplen.  This causes issues with other utilities which sanity check packet headers against the on-the-wire length.

For example, reading the original capture in tcpdump:
$ tcpdump -n -r orig.pcap 
reading from file orig.pcap, link-type EN10MB (Ethernet)
11:26:29.212874 IP 10.138.0.5.54902 > 10.138.0.6.65432: Flags [S], seq 2786883070, win 28400, options [mss 1420,sackOK,TS val 2037739231 ecr 0,nop,wscale 7], length 0
11:26:29.212936 IP 10.138.0.6.65432 > 10.138.0.5.54902: Flags [S.], seq 358205320, ack 2786883071, win 28160, options [mss 1420,sackOK,TS val 480578934 ecr 2037739231,nop,wscale 7], length 0
11:26:29.212944 IP 10.138.0.5.54902 > 10.138.0.6.65432: Flags [.], ack 1, win 222, options [nop,nop,TS val 2037739231 ecr 480578934], length 0
11:26:29.212958 IP 10.138.0.5.54902 > 10.138.0.6.65432: Flags [.], seq 1:7041, ack 1, win 222, options [nop,nop,TS val 2037739231 ecr 480578934], length 7040
11:26:29.212962 IP 10.138.0.5.54902 > 10.138.0.6.65432: Flags [.], seq 7041:14081, ack 1, win 222, options [nop,nop,TS val 2037739231 ecr 480578934], length 7040

And then after that pcap was read-in by scapy and written-out to another file:

$ tcpdump -n -r scapyd.pcap 
reading from file scapyd.pcap, link-type EN10MB (Ethernet)
11:26:29.212874 IP 10.138.0.5.54902 > 10.138.0.6.65432: Flags [S], seq 2786883070, win 28400, options [mss 1420,sackOK,TS val 2037739231 ecr 0,nop,wscale 7], length 0
11:26:29.212936 IP 10.138.0.6.65432 > 10.138.0.5.54902: Flags [S.], seq 358205320, ack 2786883071, win 28160, options [mss 1420,sackOK,TS val 480578934 ecr 2037739231,nop,wscale 7], length 0
11:26:29.212944 IP 10.138.0.5.54902 > 10.138.0.6.65432: Flags [.], ack 1, win 222, options [nop,nop,TS val 2037739231 ecr 480578934], length 0
11:26:29.212958 IP truncated-ip - 7010 bytes missing! 10.138.0.5.54902 > 10.138.0.6.65432: Flags [.], seq 1:7041, ack 1, win 222, options [nop,nop,TS val 2037739231 ecr 480578934], length 7040
11:26:29.212962 IP truncated-ip - 7010 bytes missing! 10.138.0.5.54902 > 10.138.0.6.65432: Flags [.], seq 7041:14081, ack 1, win 222, options [nop,nop,TS val 2037739231 ecr 480578934], length 7040

This also affects the willingness of utilities such as tshark to compute RTTs because the on-the-wire length stored in the per-packet pcap header does not match the packet lengths in the packet headers themselves.

**Comment by p-l-** [comment]
After applying the patch proposed in #1101, I've run:
```python
>>> wrpcap('scapy.pcap', rdpcap('orig.pcap'))
```
Then I've compared the outputs of `tshark -T fields -e frame.len -r [capture file]` for both capture files (`orig.pcap` and `scapy.pcap`) and they match.
