### ISSUE TITLE
kernel is responding to curl packet but not sr1() packet

### ISSUE THREAD

**Issue by tibetsam** [secdev/scapy#3465]
### Brief description

I'm running systemd container which is sharing root network namespace. And if i do curl command to ip x and port y, i can see tcpdump packets with tcp syn and reset.  But when i try same packet with sr1() i can only tcpdump syn packet only.

Here is curl command:
curl 192.168.16.21:4555
curl: (7) Failed to connect to 192.168.16.21 port 4555: Connection refused
and corresponding tcpdump output:
4B6R363:~ # tcpdump -i lo port 4555 -nn
tcpdump: verbose output suppressed, use -v or -vv for full protocol decode
listening on lo, link-type EN10MB (Ethernet), capture size 262144 bytes
14:14:14.863726 IP 192.168.16.21.57196 > 192.168.16.21.4555: Flags [S], seq 559774774, win 43690, options [mss 65495,sackOK,TS val 196053670 ecr 0,nop,wscale 11], length 0
14:14:14.863753 IP 192.168.16.21.4555 > 192.168.16.21.57196: Flags [R.], seq 0, ack 559774775, win 0, length 0

Here is sr1():
>>> reply = sr1(IP(dst='192.168.16.21') / TCP(sport=47964, dport=4555, flags="S"), timeout=5)  
Begin emission:
Finished sending 1 packets.
..................................................................................................................................................................................................................................................................................................................................................................................................................................................................................................................................................................................................................................................................................................................................................................................................................................................................................................................................................................................................................................
Received 994 packets, got 0 answers, remaining 1 packets

and tcpdump:
tcpdump -i lo port 4555 -nn
tcpdump: verbose output suppressed, use -v or -vv for full protocol decode
listening on lo, link-type EN10MB (Ethernet), capture size 262144 bytes
14:15:38.161925 IP 192.168.16.21.47964 > 192.168.16.21.4555: Flags [S], seq 0, win 8192, length 0
^C
1 packet captured
2 packets received by filter
0 packets dropped by kernel

cat /usr/local/lib/python3.8/site-packages/scapy/VERSION 
2.4.5

### Scapy version

2.4.5

### Python version

3.8

### Operating system

Linux 5.3.18-24.93-default

### How to reproduce

launch a systemd container with below config:

[Exec]
PrivateUsers=off
Capability=CAP_NET_ADMIN
[Files]
BindReadOnly=/etc/hostname
Bind=/etc/hosts
Bind=/etc/sysconfig/network:/etc/sysconfig/network
Bind=/var/run/dbus:/var/lib/host-dbus
[Network]
Private=off

and do curl and scapy from it

### Expected result

scapy packet should get replied

**Comment by guedou** [comment]
Please ask your question on gitter.

**Comment by tibetsam** [comment]
Hi @guedou , thanks for your suggestion, but why this is a question rather than bug? both packets have same src/dst and dport, i don't see any reason the kernel didn't respond to sr1()
